transportadora,cnpj,codigo,rota,cidade,razao_social,nome_mapa,latitude,longitude,codigo_ibge,tipo_match,fonte_coordenada
LEAO EVS,12.223.402/0001-34,91,3,ANDRADAS,DROGARIA E PERFUMARIA BEATRIZ CELEGATI GUIMARAES LTDA.,Andradas,-22.0695,-46.5724,3102605,mapa anterior,Base Municipios-Brasileiros (código IBGE e coordenadas municipais)
LEAO EVS,20.743.779/0001-42,184,3,ARAGUARI,DROGARIA COELHO LTDA,Araguari,-18.6456,-48.1934,3103504,mapa anterior,Base Municipios-Brasileiros (código IBGE e coordenadas municipais)
LEAO EVS,02.828.676/0001-01,1889,3,ARAGUARI,ALVES E COELHO LTDA.,Araguari,-18.6456,-48.1934,3103504,mapa anterior,Base Municipios-Brasileiros (código IBGE e coordenadas municipais)
LEAO EVS,13.436.812/0001-26,294,3,ARAPONGA,DROGARIA MILAGRES LTDA ME,Araponga,-20.6686,-42.5178,3103702,mapa anterior,Base Municipios-Brasileiros (código IBGE e coordenadas municipais)
LEAO EVS,09.911.582/0001-32,122,3,ARAXA,VILELA E CRUZ MEDICAMENTOS E PERFUMARIA LTDA,Araxá,-19.5902,-46.9438,3104007,mapa anterior,Base Municipios-Brasileiros (código IBGE e coordenadas municipais)
LEAO EVS,14.962.000/0001-87,373,3,ARAXA,ALESSANDRO ANTONIO DE MORAIS EPP,Araxá,-19.5902,-46.9438,3104007,mapa anterior,Base Municipios-Brasileiros (código IBGE e coordenadas municipais)
LEAO EVS,36.597.035/0001-05,818,3,ARAXA,LS DROGARIAS LTDA,Araxá,-19.5902,-46.9438,3104007,mapa anterior,Base Municipios-Brasileiros (código IBGE e coordenadas municipais)
LEAO EVS,19.858.192/0001-08,406,3,ARGIRITA,DROGARIA LUCINDO DIBO LTDA ME,Argirita,-21.6083,-42.8292,3104403,mapa anterior,Base Municipios-Brasileiros (código IBGE e coordenadas municipais)
LEAO EVS,52.922.992/0001-08,1608,3,ARINOS,POLYFARMA ARINOS LTDA,Arinos,-15.9187,-46.1043,3104502,mapa anterior,Base Municipios-Brasileiros (código IBGE e coordenadas municipais)
LEAO EVS,71.054.399/0001-31,222,3,ASTOLFO DUTRA,PORTODROGAS LTDA ME,Astolfo Dutra,-21.3184,-42.8572,3104601,mapa anterior,Base Municipios-Brasileiros (código IBGE e coordenadas municipais)
LEAO EVS,10.760.543/0001-60,1474,3,BARBACENA,DROGARIA N.S. DA PENHA DE BARBACENA LTDA,Barbacena,-21.2214,-43.7703,3105608,mapa anterior,Base Municipios-Brasileiros (código IBGE e coordenadas municipais)
LEAO EVS,37.095.048/0001-30,1821,3,BARBACENA,S J C DE FARIA LTDA,Barbacena,-21.2214,-43.7703,3105608,mapa anterior,Base Municipios-Brasileiros (código IBGE e coordenadas municipais)
LEAO EVS,16.746.170/0001-50,386,3,BARBACENA,DROGARIA E PERFUMARIA SANTAROSA,Barbacena,-21.2214,-43.7703,3105608,mapa anterior,Base Municipios-Brasileiros (código IBGE e coordenadas municipais)
LEAO EVS,32.470.783/0001-63,967,3,BARBACENA,DROGARIA MOREIRA & CONDE LTDA troca de cnpj anteriormanete 1837,Barbacena,-21.2214,-43.7703,3105608,mapa anterior,Base Municipios-Brasileiros (código IBGE e coordenadas municipais)
LEAO EVS,45.815.295/0001-92,359,3,BOM REPOUSO,DROGARIA SOMA BOM REPOUSO LTDA,Bom Repouso,-22.4675,-46.144,3107901,mapa anterior,Base Municipios-Brasileiros (código IBGE e coordenadas municipais)
LEAO EVS,63.297.680/0001-77,1893,3,BRAS PIRES,Sandra Maria Assis Araújo Ferreira,Brás Pires,-20.8419,-43.2406,3108701,mapa anterior,Base Municipios-Brasileiros (código IBGE e coordenadas municipais)
LEAO EVS,18.804.963/0001-03,1454,3,BURITIS,DROGARIA SANTA CRUZ BURITIS LTDA,Buritis,-15.6218,-46.4221,3109303,mapa anterior,Base Municipios-Brasileiros (código IBGE e coordenadas municipais)
LEAO EVS,04.249.529/0001-02,223,3,CAIANA,DROGARIA ECONOMICA DE CAIANA LTDA. - ME,Caiana,-20.6956,-41.9292,3110103,mapa anterior,Base Municipios-Brasileiros (código IBGE e coordenadas municipais)
LEAO EVS,05.792.851/0001-38,18,3,CAJURI,DROGA RONI LTDA ME,Cajuri,-20.7903,-42.7925,3110202,mapa anterior,Base Municipios-Brasileiros (código IBGE e coordenadas municipais)
LEAO EVS,22.036.321/0001-89,587,3,CAMPO DO MEIO,FARMACIA PADRE CHICO LTDA,Campo do Meio,-21.1127,-45.8273,3111309,mapa anterior,Base Municipios-Brasileiros (código IBGE e coordenadas municipais)
LEAO EVS,26.304.011/0001-59,644,3,CAMPOS ALTOS,SOARES E BRAGA LTDA ME,Campos Altos,-19.6914,-46.1725,3111507,mapa anterior,Base Municipios-Brasileiros (código IBGE e coordenadas municipais)
LEAO EVS,23.128.002/0001-66,1808,3,CAMPOS GERAIS,DROGARIA FORTE CAMPOS GERAIS LTDA,Campos Gerais,-21.237,-45.7569,3111606,mapa anterior,Base Municipios-Brasileiros (código IBGE e coordenadas municipais)
LEAO EVS,02.723.209/0001-09,78,3,CANAA,ALCIMAR LELIS SAMPAIO,Canaã,-20.6869,-42.6167,3111705,mapa anterior,Base Municipios-Brasileiros (código IBGE e coordenadas municipais)
LEAO EVS,30.409.770/0001-53,1357,3,CARANGOLA,FELIPE DA S. OLIVEIRA,Carangola,-20.7343,-42.0313,3113305,mapa anterior,Base Municipios-Brasileiros (código IBGE e coordenadas municipais)
LEAO EVS,17.890.893/0001-90,1988,3,CARANGOLA,FARMABEM ALVORADA LTDA,Carangola,-20.7343,-42.0313,3113305,mapa anterior,Base Municipios-Brasileiros (código IBGE e coordenadas municipais)
LEAO EVS,65.107.450/0001-23,120,3,CARMOPOLIS DE MINAS,BATISTA FALEIRO DROGARIA LTDA - ME,Carmópolis de Minas,-20.5396,-44.6336,3114501,mapa anterior,Base Municipios-Brasileiros (código IBGE e coordenadas municipais)
LEAO EVS,17.422.397/0001-02,488,3,CATAGUASES,MARQUEZ OLIVEIRA E ALMEIDA LTDA ME,Cataguases,-21.3924,-42.6896,3115300,mapa anterior,Base Municipios-Brasileiros (código IBGE e coordenadas municipais)
LEAO EVS,43.291.018/0001-00,1353,3,CHACARA,DROGARIA DA FAMILIA PAULA DRUGSTORE LTDA,Chácara,-21.6733,-43.215,3115904,mapa anterior,Base Municipios-Brasileiros (código IBGE e coordenadas municipais)
LEAO EVS,14.915.580/0001-51,298,3,CHAPADA GAUCHA,DROGARIA MINAS SUL LTDA,Chapada Gaúcha,-15.3014,-45.6116,3116159,mapa anterior,Base Municipios-Brasileiros (código IBGE e coordenadas municipais)
LEAO EVS,10.760.543/0002-41,1753,3,CIPOTANEA,DROGARIA N.S. DA PENHA DE BARBACENA LTDA,Cipotânea,-20.9026,-43.3629,3116308,mapa anterior,Base Municipios-Brasileiros (código IBGE e coordenadas municipais)
LEAO EVS,52.346.944/0001-19,1351,3,CONCEICAO DAS ALAGOAS,CAMPOS & SOUZA LTDA,Conceição das Alagoas,-19.9172,-48.3839,3117306,mapa anterior,Base Municipios-Brasileiros (código IBGE e coordenadas municipais)
LEAO EVS,66.518.686/0001-15,,3,CONCEICAO DO RIO VERDE,GRIMA CARLA A PEREIRA SANT ANA LTDA,Conceição do Rio Verde,-21.8778,-45.087,3117702,mapa anterior,Base Municipios-Brasileiros (código IBGE e coordenadas municipais)
LEAO EVS,26.914.568/0001-01,1340,3,CONGONHAS,FARMACIA DROGA DIAS LTDA,Congonhas,-20.4958,-43.851,3118007,mapa anterior,Base Municipios-Brasileiros (código IBGE e coordenadas municipais)
LEAO EVS,66.584.130/0001-27,1949,3,CONGONHAS,DROGARIA LARA & BIANCHINI LTDA,Congonhas,-20.4958,-43.851,3118007,mapa anterior,Base Municipios-Brasileiros (código IBGE e coordenadas municipais)
LEAO EVS,64.640.412/0001-79,1973,3,CONSELHEIRO LAFAIETE,FARMACIA DOSE CERTA,Conselheiro Lafaiete,-20.6634,-43.7846,3118304,mapa anterior,Base Municipios-Brasileiros (código IBGE e coordenadas municipais)
LEAO EVS,01.355.376/0001-81,212,3,CONSELHEIRO LAFAIETE,DROGARIA DUARTE LTDA,Conselheiro Lafaiete,-20.6634,-43.7846,3118304,mapa anterior,Base Municipios-Brasileiros (código IBGE e coordenadas municipais)
LEAO EVS,27.684.217/0001-14,408,3,CRUZILIA,DROGARIA SÃO SEBASTIÃO CRUZÍLIA LTDA,Cruzília,-21.84,-44.8067,3120805,mapa anterior,Base Municipios-Brasileiros (código IBGE e coordenadas municipais)
LEAO EVS,08.056.942/0001-01,411,3,CRUZILIA,DROGARIA SÃO SEBASTIÃO CENTRO EIRELI,Cruzília,-21.84,-44.8067,3120805,mapa anterior,Base Municipios-Brasileiros (código IBGE e coordenadas municipais)
LEAO EVS,33.111.628/0001-13,1348,3,DIVINO,A G DE SOUZA DROGARIA,Divino,-20.6134,-42.1438,3122009,mapa anterior,Base Municipios-Brasileiros (código IBGE e coordenadas municipais)
LEAO EVS,04.400.075/0001-10,1876,3,DONA EUZEBIA,DROGARIA E PERFUMARIA PRATA LTDA,Dona Eusébia,-21.319,-42.807,3122900,mapa anterior,Base Municipios-Brasileiros; grafia oficial Dona Eusébia
LEAO EVS,21.186.937/0001-73,1881,3,DONA EUZEBIA,STE DROGARIA LTDA,Dona Eusébia,-21.319,-42.807,3122900,mapa anterior,Base Municipios-Brasileiros; grafia oficial Dona Eusébia
LEAO EVS,37.141.703/0001-40,261,3,DORES DO INDAIA,DROGARIA INDAIA LTDA,Dores do Indaiá,-19.4628,-45.5927,3123205,mapa anterior,Base Municipios-Brasileiros (código IBGE e coordenadas municipais)
LEAO EVS,06.223.724/0001-80,118,3,DORES DO TURVO,DROGABELLA E OLIVEIRA LTDA,Dores do Turvo,-20.9785,-43.1834,3123304,mapa anterior,Base Municipios-Brasileiros (código IBGE e coordenadas municipais)
LEAO EVS,14.916.275/0001-84,213,3,DURANDE,DROGARIA BENFICA HUEBRA LTDA-ME,Durandé,-20.2058,-41.7977,3123528,mapa anterior,Base Municipios-Brasileiros (código IBGE e coordenadas municipais)
LEAO EVS,48.261.337/0001-89,1828,3,ENTRE RIOS DE MINAS,DROGARIA 777 MEDEIROS & SOUZA LTDA,Entre Rios de Minas,-20.6706,-44.0654,3123908,mapa anterior,Base Municipios-Brasileiros (código IBGE e coordenadas municipais)
LEAO EVS,37.714.804/0001-62,767,3,ESPERA FELIZ,SOUZA CASTRO & GONCALVES REZENDE LTDA,Espera Feliz,-20.6508,-41.9119,3124203,mapa anterior,Base Municipios-Brasileiros (código IBGE e coordenadas municipais)
LEAO EVS,02.934.194/0001-28,238,3,ESTIVA,DROGARIA FARMATRIZ LTDA,Estiva,-22.4577,-46.0191,3124500,mapa anterior,Base Municipios-Brasileiros (código IBGE e coordenadas municipais)
LEAO EVS,09.570.645/0001-34,1350,3,FERVEDOURO,DROGARIA MATOLA DE FERVEDOURO LTDA,Fervedouro,-20.726,-42.279,3125952,mapa anterior,Base Municipios-Brasileiros (código IBGE e coordenadas municipais)
LEAO EVS,13.024.095/0001-25,1523,3,FRUTAL,DROGARIA BOA VISTA DE FRUTAL LTDA,Frutal,-20.0259,-48.9355,3127107,mapa anterior,Base Municipios-Brasileiros (código IBGE e coordenadas municipais)
LEAO EVS,07.252.779/0001-81,1544,3,FRUTAL,DROGARIA DIFARMA DE FRUTAL LTDA,Frutal,-20.0259,-48.9355,3127107,mapa anterior,Base Municipios-Brasileiros (código IBGE e coordenadas municipais)
LEAO EVS,02.492.293/0001-05,582,3,FRUTAL,ANA CLEIA DE SOUZA EIRELI- ME,Frutal,-20.0259,-48.9355,3127107,mapa anterior,Base Municipios-Brasileiros (código IBGE e coordenadas municipais)
LEAO EVS,10.611.019/0001-28,1531,3,GOIANA,B & M MEDICAMENTOS LTDA,Goianá,-21.536,-43.1957,3127388,mapa anterior,Base Municipios-Brasileiros (código IBGE e coordenadas municipais)
LEAO EVS,23.934.946/0001-20,385,3,GUARACIABA,DROGARIA SANTANA LTDA,Guaraciaba,-20.5716,-43.0094,3128204,mapa anterior,Base Municipios-Brasileiros (código IBGE e coordenadas municipais)
LEAO EVS,25.142.303/0001-70,348,3,GUARANI,DROGARIA PARADELA URBANO VIEIRA LTDA,Guarani,-21.3563,-43.0328,3128402,mapa anterior,Base Municipios-Brasileiros (código IBGE e coordenadas municipais)
LEAO EVS,34.010.807/0001-27,159,3,GUIMARANIA,LORENA GONÇALVES OLIVEIRA,Guimarânia,-18.8425,-46.7901,3128907,mapa anterior,Base Municipios-Brasileiros (código IBGE e coordenadas municipais)
LEAO EVS,13.938.682/0001-20,299,3,IPANEMA,LM PHARMA & CIA LTDA,Ipanema,-19.7992,-41.7164,3131208,mapa anterior,Base Municipios-Brasileiros (código IBGE e coordenadas municipais)
LEAO EVS,14.720.441/0001-72,528,3,IPANEMA,DROGARIA MAGALHÃES LIGNANI LTDA,Ipanema,-19.7992,-41.7164,3131208,mapa anterior,Base Municipios-Brasileiros (código IBGE e coordenadas municipais)
LEAO EVS,17.617.499/0001-83,514,3,ITAGUARA,FARMÁCIA BRINA - ME,Itaguara,-20.3947,-44.4875,3132206,mapa anterior,Base Municipios-Brasileiros (código IBGE e coordenadas municipais)
LEAO EVS,27.675.127/0001-67,1321,3,ITAVERAVA,DROGARIA HELENOS LTDA,Itaverava,-20.6769,-43.6141,3133907,mapa anterior,Base Municipios-Brasileiros (código IBGE e coordenadas municipais)
LEAO EVS,07.150.985/0001-80,126,3,ITUIUTABA,DROGAMIL ITUIUTABA LTDA,Ituiutaba,-18.9772,-49.4639,3134202,mapa anterior,Base Municipios-Brasileiros (código IBGE e coordenadas municipais)
LEAO EVS,62.738.688/0001-69,1860,3,ITUIUTABA,SHOPPING DA SAUDE ITUIUTABA Ltda,Ituiutaba,-18.9772,-49.4639,3134202,mapa anterior,Base Municipios-Brasileiros (código IBGE e coordenadas municipais)
LEAO EVS,71.023.238/0001-80,263,3,ITUIUTABA,DROGARIA D'SOUZA LTDA,Ituiutaba,-18.9772,-49.4639,3134202,mapa anterior,Base Municipios-Brasileiros (código IBGE e coordenadas municipais)
LEAO EVS,07.061.111/0001-57,443,3,ITUIUTABA,FABIFARMA DROGARIA E PERFUMARIA LTDA,Ituiutaba,-18.9772,-49.4639,3134202,mapa anterior,Base Municipios-Brasileiros (código IBGE e coordenadas municipais)
LEAO EVS,15.802.709/0001-88,751,3,ITUIUTABA,SOMA DROGARIA E PERFUMARIA EIRELI,Ituiutaba,-18.9772,-49.4639,3134202,mapa anterior,Base Municipios-Brasileiros (código IBGE e coordenadas municipais)
LEAO EVS,10.524.830/0001-71,759,3,ITUIUTABA,SHOPPING DROGARIA MEDICAMENTOS & PERFUMARIA EIRELI,Ituiutaba,-18.9772,-49.4639,3134202,mapa anterior,Base Municipios-Brasileiros (código IBGE e coordenadas municipais)
LEAO EVS,05.769.814/0001-09,281,3,JEQUERI,DROGARIA SANTOS BAIÃO LTDA,Jequeri,-20.4542,-42.6651,3135506,mapa anterior,Base Municipios-Brasileiros (código IBGE e coordenadas municipais)
LEAO EVS,44.208.170/0001-31,,3,JUIZ DE FORA,PAULA SILVERIO DE OLIVEIRA MACANHAM (CNPJ FICTICIO),Juiz de Fora,-21.7595,-43.3398,3136702,mapa anterior,Base Municipios-Brasileiros (código IBGE e coordenadas municipais)
LEAO EVS,09.440.889/0001-00,1290,3,JUIZ DE FORA,DROGARIA BORBOLETA LTDA Não vender,Juiz de Fora,-21.7595,-43.3398,3136702,mapa anterior,Base Municipios-Brasileiros (código IBGE e coordenadas municipais)
LEAO EVS,20.422.374/0001-02,1291,3,JUIZ DE FORA,DROGA PASSOS LTDA,Juiz de Fora,-21.7595,-43.3398,3136702,mapa anterior,Base Municipios-Brasileiros (código IBGE e coordenadas municipais)
LEAO EVS,31.739.419/0001-93,1293,3,JUIZ DE FORA,FABIO LUIZ DIAS CAPUTO,Juiz de Fora,-21.7595,-43.3398,3136702,mapa anterior,Base Municipios-Brasileiros (código IBGE e coordenadas municipais)
LEAO EVS,29.120.206/0001-37,1294,3,JUIZ DE FORA,DROGARIA SAO BARTOLOMEU LTDA,Juiz de Fora,-21.7595,-43.3398,3136702,mapa anterior,Base Municipios-Brasileiros (código IBGE e coordenadas municipais)
LEAO EVS,10.973.610/0001-25,1295,3,JUIZ DE FORA,CAPUTO DROGARIAS MONTE CASTELO LTDA,Juiz de Fora,-21.7595,-43.3398,3136702,mapa anterior,Base Municipios-Brasileiros (código IBGE e coordenadas municipais)
LEAO EVS,03.996.272/0001-81,1296,3,JUIZ DE FORA,CHINAIT MATTOS E CIA LTDA,Juiz de Fora,-21.7595,-43.3398,3136702,mapa anterior,Base Municipios-Brasileiros (código IBGE e coordenadas municipais)
LEAO EVS,17.578.135/0001-31,1297,3,JUIZ DE FORA,DROGARIA DO CENTRO LTDA,Juiz de Fora,-21.7595,-43.3398,3136702,mapa anterior,Base Municipios-Brasileiros (código IBGE e coordenadas municipais)
LEAO EVS,14.357.606/0001-93,1298,3,JUIZ DE FORA,CASTRO E DUTRA CIA DRUGSTORE LTDA,Juiz de Fora,-21.7595,-43.3398,3136702,mapa anterior,Base Municipios-Brasileiros (código IBGE e coordenadas municipais)
LEAO EVS,04.706.828/0001-10,1304,3,JUIZ DE FORA,DROGARIA YUNG LTDA,Juiz de Fora,-21.7595,-43.3398,3136702,mapa anterior,Base Municipios-Brasileiros (código IBGE e coordenadas municipais)
LEAO EVS,41.746.892/0001-51,1310,3,JUIZ DE FORA,DROGAELLE LTDA,Juiz de Fora,-21.7595,-43.3398,3136702,mapa anterior,Base Municipios-Brasileiros (código IBGE e coordenadas municipais)
LEAO EVS,27.934.539/0001-74,1311,3,JUIZ DE FORA,DROGARIA TEIXEIRAS LTDA,Juiz de Fora,-21.7595,-43.3398,3136702,mapa anterior,Base Municipios-Brasileiros (código IBGE e coordenadas municipais)
LEAO EVS,05.594.985/0001-44,1314,3,JUIZ DE FORA,DROGARIA SULNORTE LTDA,Juiz de Fora,-21.7595,-43.3398,3136702,mapa anterior,Base Municipios-Brasileiros (código IBGE e coordenadas municipais)
LEAO EVS,19.580.547/0001-31,1315,3,JUIZ DE FORA,DROGARIA MAGALHAES LTDA,Juiz de Fora,-21.7595,-43.3398,3136702,mapa anterior,Base Municipios-Brasileiros (código IBGE e coordenadas municipais)
LEAO EVS,48.008.732/0001-54,1316,3,JUIZ DE FORA,DROGARIA FONTESVILLE LTDA,Juiz de Fora,-21.7595,-43.3398,3136702,mapa anterior,Base Municipios-Brasileiros (código IBGE e coordenadas municipais)
LEAO EVS,42.952.807/0001-74,1470,3,JUIZ DE FORA,CAPUTO DROGARIAS LTDA,Juiz de Fora,-21.7595,-43.3398,3136702,mapa anterior,Base Municipios-Brasileiros (código IBGE e coordenadas municipais)
LEAO EVS,52.654.147/0001-07,1543,3,JUIZ DE FORA,F&V FARMA LTDA,Juiz de Fora,-21.7595,-43.3398,3136702,mapa anterior,Base Municipios-Brasileiros (código IBGE e coordenadas municipais)
LEAO EVS,55.273.664/0001-16,1581,3,JUIZ DE FORA,DROGARIA CIDADE DO SOL LTDA,Juiz de Fora,-21.7595,-43.3398,3136702,mapa anterior,Base Municipios-Brasileiros (código IBGE e coordenadas municipais)
LEAO EVS,22.657.402/0001-04,1652,3,JUIZ DE FORA,VAREJAO GETULIO VARGAS LTDA,Juiz de Fora,-21.7595,-43.3398,3136702,mapa anterior,Base Municipios-Brasileiros (código IBGE e coordenadas municipais)
LEAO EVS,30.208.925/0001-93,168,3,JUIZ DE FORA,DROGARIA DO BAIRRO LTDA,Juiz de Fora,-21.7595,-43.3398,3136702,mapa anterior,Base Municipios-Brasileiros (código IBGE e coordenadas municipais)
LEAO EVS,58.920.991/0001-00,1704,3,JUIZ DE FORA,ARV FARMA DRUGSTORE LTDA,Juiz de Fora,-21.7595,-43.3398,3136702,mapa anterior,Base Municipios-Brasileiros (código IBGE e coordenadas municipais)
LEAO EVS,13.416.216/0001-84,291,3,JUIZ DE FORA,DROGARIA MENDES ALMAS LTDA,Juiz de Fora,-21.7595,-43.3398,3136702,mapa anterior,Base Municipios-Brasileiros (código IBGE e coordenadas municipais)
LEAO EVS,30.805.933/0001-17,756,3,JUIZ DE FORA,RV DRUGSTORE COMERCIAL LTDA,Juiz de Fora,-21.7595,-43.3398,3136702,mapa anterior,Base Municipios-Brasileiros (código IBGE e coordenadas municipais)
LEAO EVS,07.909.086/0001-19,646,3,LAGAMAR,CLAUDIENE CRISTINA DE OLIVEIRA ME,Lagamar,-18.1759,-46.8063,3137106,mapa anterior,Base Municipios-Brasileiros (código IBGE e coordenadas municipais)
LEAO EVS,62.908.631/0001-60,1842,3,LAGOA DA PRATA,Gabriela Campos de Oliveira Filgueira,Lagoa da Prata,-20.0237,-45.5401,3137205,mapa anterior,Base Municipios-Brasileiros (código IBGE e coordenadas municipais)
LEAO EVS,08.696.160/0001-29,204,3,LAGOA DOURADA,ITAMAR GOMES DA SILVA,Lagoa Dourada,-20.9139,-44.0797,3137403,mapa anterior,Base Municipios-Brasileiros (código IBGE e coordenadas municipais)
LEAO EVS,04.763.672/0001-00,170,3,LAGOA GRANDE,NOVA QUIMICA MEDICAMENTOS LTDA,Lagoa Grande,-17.8323,-46.5165,3137536,mapa anterior,Base Municipios-Brasileiros (código IBGE e coordenadas municipais)
LEAO EVS,00.619.768/0001-48,158,3,LIMA DUARTE,DROGARIA REZENDE CUNHA LTDA,Lima Duarte,-21.8386,-43.7934,3138609,mapa anterior,Base Municipios-Brasileiros (código IBGE e coordenadas municipais)
LEAO EVS,60.950.815/0001-63,1787,3,LUZ,ATERRADO FARMA,Luz,-19.7911,-45.6794,3138807,mapa anterior,Base Municipios-Brasileiros (código IBGE e coordenadas municipais)
LEAO EVS,49.944.337/0001-46,667,3,MANHUMIRIM,DIEGO RODRIGUES MENDES DE OLIVEIRA LTDA,Manhumirim,-20.3591,-41.9589,3139508,mapa anterior,Base Municipios-Brasileiros (código IBGE e coordenadas municipais)
LEAO EVS,14.916.275/0002-65,746,3,MARTINS SOARES,DROGARIA BENFICA HUEBRA LTDA,Martins Soares,-20.2546,-41.8786,3140530,mapa anterior,Base Municipios-Brasileiros (código IBGE e coordenadas municipais)
LEAO EVS,10.431.817/0001-78,12,3,MATIPO,ATENDE FARMA LTDA ME,Matipó,-20.2873,-42.3401,3140902,mapa anterior,Base Municipios-Brasileiros (código IBGE e coordenadas municipais)
LEAO EVS,10.822.925/0001-71,292,3,MATIPO,DROGARIA DROGAMENDES LTDA - ME,Matipó,-20.2873,-42.3401,3140902,mapa anterior,Base Municipios-Brasileiros (código IBGE e coordenadas municipais)
LEAO EVS,05.230.576/0001-69,20,3,MIRADOURO,DROGAMILE MIRADOURO LTDA,Miradouro,-20.8899,-42.3458,3142106,mapa anterior,Base Municipios-Brasileiros (código IBGE e coordenadas municipais)
LEAO EVS,24.879.559/0001-00,257,3,MONTE ALEGRE DE MINAS,DROGARIA COMPRE BEM LTDA ME,Monte Alegre de Minas,-18.869,-48.881,3142809,mapa anterior,Base Municipios-Brasileiros (código IBGE e coordenadas municipais)
LEAO EVS,04.941.512/0001-03,1902,3,MONTE CARMELO,DROGARIA MOREIRA & CAMPOS MC LTDA,Monte Carmelo,-18.7302,-47.4912,3143104,mapa anterior,Base Municipios-Brasileiros (código IBGE e coordenadas municipais)
LEAO EVS,02.441.215/0001-73,1903,3,MONTE CARMELO,DROGARIA RAMOS & CARVALHO LTDA,Monte Carmelo,-18.7302,-47.4912,3143104,mapa anterior,Base Municipios-Brasileiros (código IBGE e coordenadas municipais)
LEAO EVS,19.370.006/0001-89,704,3,MONTE SANTO DE MINAS,TJ FARMA LTDA,Monte Santo de Minas,-21.1873,-46.9753,3143203,mapa anterior,Base Municipios-Brasileiros (código IBGE e coordenadas municipais)
LEAO EVS,40.589.728/0001-15,277,3,MORADA NOVA DE MINAS,MORADA NOVA DROGARIA E DRUGSTORE LTDA,Morada Nova de Minas,-18.5998,-45.3584,3143500,mapa anterior,Base Municipios-Brasileiros (código IBGE e coordenadas municipais)
LEAO EVS,05.914.781/0001-43,143,3,MURIAE,DROGARIA DOSE CERTA MURIAÉ LTDA ME,Muriaé,-21.13,-42.3693,3143906,mapa anterior,Base Municipios-Brasileiros (código IBGE e coordenadas municipais)
LEAO EVS,33.538.152/0001-00,1568,3,MURIAE,SUPER FARMA DE MURIAE LTDA,Muriaé,-21.13,-42.3693,3143906,mapa anterior,Base Municipios-Brasileiros (código IBGE e coordenadas municipais)
LEAO EVS,18.351.551/0001-65,446,3,MUTUM,DROGARIA SUELY LTDA - EPP,Mutum,-19.8121,-41.4407,3144003,mapa anterior,Base Municipios-Brasileiros (código IBGE e coordenadas municipais)
LEAO EVS,10.834.193/0001-30,254,3,NOVA PONTE,DROGARIA CECATO E PINTO LTDA ME,Nova Ponte,-19.1461,-47.6779,3145000,mapa anterior,Base Municipios-Brasileiros (código IBGE e coordenadas municipais)
LEAO EVS,43.449.585/0001-34,264,3,NOVA SERRANA,DROGARIA IRMAOS SERRANA LTDA,Nova Serrana,-19.8713,-44.9847,3145208,mapa anterior,Base Municipios-Brasileiros (código IBGE e coordenadas municipais)
LEAO EVS,07.652.081/0001-53,,3,ORIZANIA,DROGARIA DM GENERICA ORIZANIA LTDA,Orizânia,-20.5142,-42.1991,3145877,mapa anterior,Base Municipios-Brasileiros (código IBGE e coordenadas municipais)
LEAO EVS,07.892.932/0001-35,176,3,ORIZANIA,DROGARIA OLIVEIRA E COELHO LTDA ME,Orizânia,-20.5142,-42.1991,3145877,mapa anterior,Base Municipios-Brasileiros (código IBGE e coordenadas municipais)
LEAO EVS,24.260.111/0001-03,310,3,OURO BRANCO,JA DA SILVA DROGARIA LTDA ME,Ouro Branco,-20.5263,-43.6962,3145901,mapa anterior,Base Municipios-Brasileiros (código IBGE e coordenadas municipais)
LEAO EVS,22.239.913/0001-06,358,3,PARA DE MINAS,DROGARIA RECANTO FARMA ME,Pará de Minas,-19.8534,-44.6114,3147105,mapa anterior,Base Municipios-Brasileiros (código IBGE e coordenadas municipais)
LEAO EVS,14.071.646/0001-74,240,3,PARACATU,DROGARIA FERNANDES E FERNANDES LTDA,Paracatu,-17.2252,-46.8711,3147006,mapa anterior,Base Municipios-Brasileiros (código IBGE e coordenadas municipais)
LEAO EVS,10.364.093/0001-97,462,3,PARACATU,RENZO CARNEIRO DE MENDONÇA FILHO ME,Paracatu,-17.2252,-46.8711,3147006,mapa anterior,Base Municipios-Brasileiros (código IBGE e coordenadas municipais)
LEAO EVS,23.805.406/0001-47,1461,3,PASSOS,DROGARIA RC PRECO MINIMO LTDA,Passos,-20.7193,-46.609,3147907,mapa anterior,Base Municipios-Brasileiros (código IBGE e coordenadas municipais)
LEAO EVS,23.805.406/0002-28,1549,3,PASSOS,DROGARIA RC PRECO MINIMO LTDA,Passos,-20.7193,-46.609,3147907,mapa anterior,Base Municipios-Brasileiros (código IBGE e coordenadas municipais)
LEAO EVS,22.504.898/0001-78,169,3,PATOS DE MINAS,JOSE DOS REIS SILVA E CIA LTDA,Patos de Minas,-18.5699,-46.5013,3148004,mapa anterior,Base Municipios-Brasileiros (código IBGE e coordenadas municipais)
LEAO EVS,43.731.052/0001-40,330,3,PATOS DE MINAS,DROGARIA OURO FARMA LTDA,Patos de Minas,-18.5699,-46.5013,3148004,mapa anterior,Base Municipios-Brasileiros (código IBGE e coordenadas municipais)
LEAO EVS,02.535.182/0001-20,365,3,PATOS DE MINAS,DROGA-ROMA LTDA,Patos de Minas,-18.5699,-46.5013,3148004,mapa anterior,Base Municipios-Brasileiros (código IBGE e coordenadas municipais)
LEAO EVS,13.696.454/0001-90,1449,3,PATROCINIO,UNIAO PRODUTOS FARMACEUTICOS LTDA,Patrocínio,-18.9379,-46.9934,3148103,mapa anterior,Base Municipios-Brasileiros (código IBGE e coordenadas municipais)
LEAO EVS,11.425.064/0001-50,179,3,PEDRA BONITA,DROGARIA CAMPOS MARTINS PIMENTEL LTDA EPP,Pedra Bonita,-20.5219,-42.3304,3148756,mapa anterior,Base Municipios-Brasileiros (código IBGE e coordenadas municipais)
LEAO EVS,17.763.863/0001-13,308,3,PEDRA DO ANTA,DROGARIA VIANA & VIANA LTDA ME,Pedra do Anta,-20.5968,-42.7123,3148806,mapa anterior,Base Municipios-Brasileiros (código IBGE e coordenadas municipais)
LEAO EVS,11.627.309/0001-22,400,3,PIEDADE DE PONTE NOVA,DROGARIA E PERFUMARIA SÃO JUDAS TADEU,Piedade de Ponte Nova,-20.2438,-42.7379,3150208,mapa anterior,Base Municipios-Brasileiros (código IBGE e coordenadas municipais)
LEAO EVS,04.715.718/0001-15,393,3,PIMENTA,SEBASTIÃO SOARES DE MELO ME,Pimenta,-20.4827,-45.8049,3150505,mapa anterior,Base Municipios-Brasileiros (código IBGE e coordenadas municipais)
LEAO EVS,23.789.282/0001-53,206,3,PIRANGA,MARIA DAS DORES FERNANDES QUINTÃO CELESTINO,Piranga,-20.6834,-43.2967,3150802,mapa anterior,Base Municipios-Brasileiros (código IBGE e coordenadas municipais)
LEAO EVS,20.433.783/0001-04,1920,3,PIRAUBA,DROGARIA PARADELA E URBANO LTDA,Piraúba,-21.2825,-43.0172,3151305,mapa anterior,Base Municipios-Brasileiros (código IBGE e coordenadas municipais)
LEAO EVS,29.283.051/0001-50,128,3,PIUMHI,DROGARIA NEVES E ALMEIDA LTDA-ME,Piumhi,-20.4762,-45.9589,3151503,mapa anterior,Base Municipios-Brasileiros (código IBGE e coordenadas municipais)
LEAO EVS,14.693.399/0001-48,589,3,POCRANE,EDMAR FERREIRA DOS REIS - ME,Pocrane,-19.6208,-41.6334,3151909,mapa anterior,Base Municipios-Brasileiros (código IBGE e coordenadas municipais)
LEAO EVS,25.260.804/0001-50,331,3,PONTE NOVA,ZANELATO E SAQUETO FARMACIA E DROGARIA LTDA - ME,Ponte Nova,-20.4111,-42.8978,3152105,mapa anterior,Base Municipios-Brasileiros (código IBGE e coordenadas municipais)
LEAO EVS,09.149.300/0001-01,524,3,PONTE NOVA,DROGARIA DO PAULO E CIA LTDA,Ponte Nova,-20.4111,-42.8978,3152105,mapa anterior,Base Municipios-Brasileiros (código IBGE e coordenadas municipais)
