transportadora,cnpj,codigo,rota,cidade,razao_social,nome_mapa,latitude,longitude,codigo_ibge,tipo_match,fonte_coordenada
BRASPRESS IPN,07.696.593/0001-11,568,2,NOVO CRUZEIRO,FARMACIA KRETLE E MATOS LTDA,Novo Cruzeiro,-17.4654,-41.8826,3145307,município,Base Municipios-Brasileiros
BRASPRESS IPN,11.790.016/0001-61,372,2,NOVO HORIZONTE,ALMEIDA E BRITO COM.DE PROD.FARMACEUTICOS LTDA,Novo Horizonte,-21.4651,-49.2234,3533502,município,Base Municipios-Brasileiros
BRASPRESS IPN,12.391.259/0001-90,353,2,NOVO ORIENTE DE MINAS,DIDIDHATHA COMERCIO DE PRODUTOS FARMACEUTICOS LTDA,Novo Oriente de Minas,-17.4089,-41.2194,3145356,município,Base Municipios-Brasileiros
BRASPRESS IPN,41.582.845/0001-10,533,2,OEIRAS,LUZINETE MARIA DA COSTA VELOSO LTDA,Oeiras,-7.01915,-42.1283,2207009,município,Base Municipios-Brasileiros
BRASPRESS IPN,21.097.427/0001-20,586,2,OLHOS DAGUA,DROGARIA E PERFUMARIA OLHOS DAGUA LTDA ME,Olhos d'Água,-17.3982,-43.5719,3145455,grafia alternativa,Base Municipios-Brasileiros
BRASPRESS IPN,18.247.139/0001-08,123,2,OLIMPIA,DROGAFARMA OLIMPIA LTDA,Olímpia,-20.7366,-48.9106,3533908,município,Base Municipios-Brasileiros
BRASPRESS IPN,53.439.294/0001-19,1894,2,OLIVEIRA DOS BREJINHOS,ROBINSON NOVAES DA SILVA,Oliveira dos Brejinhos,-12.3132,-42.8969,2923209,município,Base Municipios-Brasileiros
BRASPRESS IPN,40.242.197/0001-90,1981,2,OSASCO,ALR DROGARIA E PERFUMARIA LTDA,Osasco,-23.5324,-46.7916,3534401,município,Base Municipios-Brasileiros
BRASPRESS IPN,37.612.672/0001-68,1983,2,OSASCO,DROGARIA POPULAR VILA DOS REMEDIOS,Osasco,-23.5324,-46.7916,3534401,município,Base Municipios-Brasileiros
BRASPRESS IPN,13.472.616/0001-07,69,2,OSASCO,DROGAMED MUNHOZ LTDA,Osasco,-23.5324,-46.7916,3534401,município,Base Municipios-Brasileiros
BRASPRESS IPN,07.291.062/0001-49,70,2,OSASCO,DROGAMED SAKATAUSKAS LTDA,Osasco,-23.5324,-46.7916,3534401,município,Base Municipios-Brasileiros
BRASPRESS IPN,17.303.857/0001-83,1657,2,OURO VERDE DE MINAS,DROGARIA E PERFUMARIA ENFARMA LTDA,Ouro Verde de Minas,-18.0719,-41.2734,3146206,município,Base Municipios-Brasileiros
BRASPRESS IPN,12.939.421/0001-61,634,2,PADRE PARAISO,REGINALDO ANTONIO DA SILVA,Padre Paraíso,-17.0758,-41.4821,3146305,município,Base Municipios-Brasileiros
BRASPRESS IPN,07.258.077/0002-96,473,2,PALMOPOLIS,DROGARIA SENHOR DOS PASSOS LTDA ME FILIAL PALMÓPOLIS,Palmópolis,-16.7364,-40.4296,3146750,município,Base Municipios-Brasileiros
BRASPRESS IPN,13.100.248/0002-57,134,2,PARATINGA,DROGAMIL COMÉRCIO DE PRODUTOS FARMACÊUTICOS,Paratinga,-12.687,-43.1798,2923704,município,Base Municipios-Brasileiros
BRASPRESS IPN,18.156.713/0001-04,1907,2,PARATY,MJEF DROGARIA LTDA,Paraty,-23.2221,-44.7175,3303807,município,Base Municipios-Brasileiros
BRASPRESS IPN,34.643.298/0001-70,1914,2,PARATY,ARVELOS CAMPOS DROGARIA LTDA,Paraty,-23.2221,-44.7175,3303807,município,Base Municipios-Brasileiros
BRASPRESS IPN,61.638.150/0001-10,1943,2,PARATY,JARDIM CAMPOS DROGARIA LTDA,Paraty,-23.2221,-44.7175,3303807,município,Base Municipios-Brasileiros
BRASPRESS IPN,70.315.106/0009-17,1426,2,PARNAMIRIM,EMPREENDIMENTO FARMACEUTICO SANTA FE LTDA,Parnamirim,-5.91116,-35.271,2403251,município,Base Municipios-Brasileiros
BRASPRESS IPN,41.934.977/0001-63,219,2,PAULISTAS,DROGARIA E PERFUMARIA SONOSSA LTDA - MATRIZ,Paulistas,-18.4276,-42.8628,3148400,município,Base Municipios-Brasileiros
BRASPRESS IPN,27.161.936/0001-50,476,2,PAVAO,GABRIELLE BATISTA VIEIRA,Pavão,-17.4267,-41.0035,3148509,município,Base Municipios-Brasileiros
BRASPRESS IPN,17.903.160/0001-43,81,2,PECANHA,DROGARIA NUNES E NUNES LTDA,Peçanha,-18.5441,-42.5583,3148608,município,Base Municipios-Brasileiros
BRASPRESS IPN,04.987.092/0001-04,537,2,PEROLA,U S CARBONERA E CIA LTDA,Pérola,-23.8039,-53.6834,4118907,município,Base Municipios-Brasileiros
BRASPRESS IPN,10.807.681/0001-58,781,2,PESCADOR,NATHALIA B P COSTA DROGARIA ME,Pescador,-18.357,-41.6006,3150000,município,Base Municipios-Brasileiros
BRASPRESS IPN,26.254.703/0001-30,1906,2,PETROPOLIS,PETRO-ISA DROGARIA LTDA,Petrópolis,-22.52,-43.1926,3303906,município,Base Municipios-Brasileiros
BRASPRESS IPN,28.203.801/0001-73,510,2,PIEDADE DE CARATINGA,J&E DROG LTDA ME,Piedade de Caratinga,-19.7593,-42.0756,3150158,município,Base Municipios-Brasileiros
BRASPRESS IPN,38.078.792/0001-90,447,2,PINDAI,LUCAS THARCIO RODRIGUES SANTOS,Pindaí,-14.4921,-42.686,2924504,município,Base Municipios-Brasileiros
BRASPRESS IPN,07.717.968/0001-82,1599,2,PINDORAMA,ANTONIO DONIZETI ALIBERTI LTDA,Pindorama,-21.1853,-48.9086,3538105,município,Base Municipios-Brasileiros
BRASPRESS IPN,55.974.991/0001-03,1600,2,PINHAO,VILA NOVA DROGARIA LTDA,Pinhão,-25.6944,-51.6536,4119301,município,Base Municipios-Brasileiros
BRASPRESS IPN,54.842.692/0001-44,1496,2,PIRACICABA,DROGARIA BOA SAUDE PIRACICABA LTDA,Piracicaba,-22.7338,-47.6476,3538709,município,Base Municipios-Brasileiros
BRASPRESS IPN,19.150.140/0001-74,1432,2,PIRIPA,LUCIMAR RODRIGUES FAGUNDES MARTINS,Piripá,-14.9444,-41.7168,2924702,município,Base Municipios-Brasileiros
BRASPRESS IPN,19.950.015/0001-49,1284,2,PIRITIBA,FARMACIA SAMPAIO LTDA,Piritiba,-11.73,-40.5587,2924801,município,Base Municipios-Brasileiros
BRASPRESS IPN,07.253.843/0001-49,611,2,PLANALTO,RUIFARMA LTDA,Planalto,-21.0342,-49.933,3539608,município,Base Municipios-Brasileiros
BRASPRESS IPN,02.747.505/0001-40,511,2,POCO VERDE,DROGARIA JJ LTDA - ME,Poço Verde,-10.7151,-38.1813,2805505,município,Base Municipios-Brasileiros
BRASPRESS IPN,11.959.031/0001-90,754,2,POCOES,RENILDES PEREIRA DE SOUZA E CIA LTDA,Poções,-14.5234,-40.3634,2925105,município,Base Municipios-Brasileiros
BRASPRESS IPN,35.763.973/0001-67,731,2,POJUCA,B.M. DE SA,Pojuca,-12.4303,-38.3374,2925204,município,Base Municipios-Brasileiros
BRASPRESS IPN,05.095.029/0001-18,623,2,PORTO SEGURO,MARCO POLO MACHADO FROSSARD DE PORTO SEGURO,Porto Seguro,-16.4435,-39.0643,2925303,município,Base Municipios-Brasileiros
BRASPRESS IPN,38.820.716/0001-08,1610,2,PORTO VELHO,FERNANDES COMÉRCIO DE MEDICAMENTOS LTDA,Porto Velho,-8.76077,-63.8999,1100205,município,Base Municipios-Brasileiros
BRASPRESS IPN,42.377.379/0003-65,666,2,PRAIA GRANDE,FARMA 22 FARMACIA DIGITAL LTDA,Praia Grande,-24.0084,-46.4121,3541000,município,Base Municipios-Brasileiros
BRASPRESS IPN,12.445.924/0001-80,1476,2,PRESIDENTE JANIO QUADROS,DROGARIA MENDES E OLIVEIRA LTDA,Presidente Jânio Quadros,-14.6885,-41.6798,2925709,município,Base Municipios-Brasileiros
BRASPRESS IPN,59.995.678/0001-02,1877,2,PRESIDENTE KENNEDY,A CAMARA PRODUTOS FARMACEUTICOS LTDA,Presidente Kennedy,-21.0964,-41.0468,3204302,município,Base Municipios-Brasileiros
BRASPRESS IPN,08.948.560/0002-65,661,2,PRESIDENTE KENNEDY,H S PRODUTOS FARMACEUTICOS LTDA,Presidente Kennedy,-21.0964,-41.0468,3204302,município,Base Municipios-Brasileiros
BRASPRESS IPN,05.046.702/0001-20,80,2,PRESIDENTE KUBITSHEK,AMFAR DROGARIA E DRUGSTORE LTDA,Presidente Kubitschek,-18.6193,-43.5628,3153301,grafia alternativa,Base Municipios-Brasileiros
BRASPRESS IPN,01.987.999/0001-77,1919,2,PRIMAVERA DO LESTE,DROGARIA DROGA FACIL LTDA,Primavera do Leste,-15.544,-54.2811,5107040,município,Base Municipios-Brasileiros
BRASPRESS IPN,16.758.086/0001-56,1380,2,QUIRINOPOLIS,DROGARIA ALPHAVILLE LTDA,Quirinópolis,-18.4472,-50.4547,5218508,município,Base Municipios-Brasileiros
BRASPRESS IPN,11.578.397/0001-10,1438,2,QUIRINOPOLIS,RODRIGUES GOULART COMERCIO DE MEDICAMENTOS LTDA,Quirinópolis,-18.4472,-50.4547,5218508,município,Base Municipios-Brasileiros
BRASPRESS IPN,02.949.285/0001-37,1565,2,QUIRINOPOLIS,SAO JOSE COMERCIO E MEDICAMENTO LTDA,Quirinópolis,-18.4472,-50.4547,5218508,município,Base Municipios-Brasileiros
BRASPRESS IPN,07.132.094/0001-00,153,2,REDENCAO,DROGARIA ARAGUAIA LTDA - ME,Redenção,-8.02529,-50.0317,1506138,município,Base Municipios-Brasileiros
BRASPRESS IPN,25.164.007/0001-70,1798,2,RIBEIRAO DAS NEVES,DROGA JAP LTDA,Ribeirão das Neves,-19.7621,-44.0844,3154606,mapa anterior,Base Municipios-Brasileiros (código IBGE e coordenadas municipais)
BRASPRESS IPN,65.378.614/0001-57,251,2,RIBEIRAO DAS NEVES,APARECIDA E PROFETA COMERCIO DE DROGAS LTDA,Ribeirão das Neves,-19.7621,-44.0844,3154606,mapa anterior,Base Municipios-Brasileiros (código IBGE e coordenadas municipais)
BRASPRESS IPN,27.756.318/0001-53,1452,2,RIBEIRAO PRETO,VALDENUCI JULIANO DROGARIA LTDA ME,Ribeirão Preto,-21.1699,-47.8099,3543402,município,Base Municipios-Brasileiros
BRASPRESS IPN,45.376.683/0001-14,1463,2,RIBEIRAO PRETO,GALANTI FARMA DROGARIA LTDA,Ribeirão Preto,-21.1699,-47.8099,3543402,município,Base Municipios-Brasileiros
BRASPRESS IPN,39.410.190/0004-01,1901,2,RIO BONITO,DROGARIA CENTRAL DE ITABORAI LTDA,Rio Bonito,-22.7181,-42.6276,3304300,município,Base Municipios-Brasileiros
BRASPRESS IPN,47.570.329/0001-51,1921,2,RIO CLARO,DROGARIA MAX BANDEIRANTES VARGEM PEQUENA,Rio Claro,-22.3984,-47.5546,3543907,município,Base Municipios-Brasileiros
BRASPRESS IPN,29.881.218/0001-84,233,2,RIO CLARO,LG DO ROSARIO,Rio Claro,-22.3984,-47.5546,3543907,município,Base Municipios-Brasileiros
BRASPRESS IPN,42.820.433/0001-33,234,2,RIO CLARO,HRD NOGUEIRA LTDA,Rio Claro,-22.3984,-47.5546,3543907,município,Base Municipios-Brasileiros
BRASPRESS IPN,48.077.175/0001-23,,2,RIO DE JANEIRO,ALEFARMA DROGARIAS E PERFUMARIA DE SANTA CRUZ LTDA,Rio de Janeiro,-22.9129,-43.2003,3304557,município,Base Municipios-Brasileiros
BRASPRESS IPN,07.409.547/0001-94,151,2,RIO DE JANEIRO,FARMÁCIA VIP LTDA,Rio de Janeiro,-22.9129,-43.2003,3304557,município,Base Municipios-Brasileiros
BRASPRESS IPN,02.549.313/0001-29,1545,2,RIO DE JANEIRO,DROGARIA PRECISAO DO CENTRO LTDA,Rio de Janeiro,-22.9129,-43.2003,3304557,município,Base Municipios-Brasileiros
BRASPRESS IPN,37.914.228/0001-05,1916,2,RIO DE JANEIRO,DROGARIA BARRA PLAZA LTDA,Rio de Janeiro,-22.9129,-43.2003,3304557,município,Base Municipios-Brasileiros
BRASPRESS IPN,10.732.646/0001-17,471,2,RIO DE JANEIRO,FARMACIA CENTRAL DO BOM RETIRO LTDA,Rio de Janeiro,-22.9129,-43.2003,3304557,município,Base Municipios-Brasileiros
BRASPRESS IPN,17.162.776/0001-00,766,2,RIO DE JANEIRO,DROGARIA JAUFARMA LTDA,Rio de Janeiro,-22.9129,-43.2003,3304557,município,Base Municipios-Brasileiros
BRASPRESS IPN,23.249.584/0001-39,315,2,RIO VERMELHO,DROGARIA NOSSA SENHORA DE LOURDES RIO VERMELHO LTDA ME,Rio Vermelho,-18.2922,-43.0018,3156007,município,Base Municipios-Brasileiros
BRASPRESS IPN,86.400.413/0001-89,366,2,RUBIM,DROGARIA RUBIM LTDA,Rubim,-16.3775,-40.5397,3156601,município,Base Municipios-Brasileiros
BRASPRESS IPN,04.668.560/0001-70,241,2,SABINOPOLIS,DROGARIA FERNANDES GUERRA LTDA,Sabinópolis,-18.6653,-43.0752,3156809,município,Base Municipios-Brasileiros
BRASPRESS IPN,62.690.153/0001-65,1880,2,SALTO,FARMA MORILLIA LTDA,Salto,-23.1996,-47.2931,3545209,município,Base Municipios-Brasileiros
BRASPRESS IPN,14.009.096/0001-63,,2,SALVADOR,DARCY SILVA DE SOUZA (CNPJ FICTICIO),Salvador,-12.9718,-38.5011,2927408,município,Base Municipios-Brasileiros
BRASPRESS IPN,67.111.002/0001-29,,2,SALVADOR,FARMA SOUZA PRODUTOS FARMACEUTICOS LTDA,Salvador,-12.9718,-38.5011,2927408,município,Base Municipios-Brasileiros
BRASPRESS IPN,46.037.089/0001-61,1362,2,SALVADOR,FARMACIA E DROGARIA ALCANTARA LTDA,Salvador,-12.9718,-38.5011,2927408,município,Base Municipios-Brasileiros
BRASPRESS IPN,43.066.555/0001-49,293,2,SALVADOR,DROGARIA MENEZES COMERCIO DE MEDICAMENTO LTDA,Salvador,-12.9718,-38.5011,2927408,município,Base Municipios-Brasileiros
BRASPRESS IPN,41.639.864/0001-35,495,2,SALVADOR,FARMA LIFE VIEIRA LTDA,Salvador,-12.9718,-38.5011,2927408,município,Base Municipios-Brasileiros
BRASPRESS IPN,38.421.445/0001-18,684,2,SALVADOR,MARYSAN FARMA COMÉRCIO VAREJISTA DE PRODUTOS FARMACÊUTICOS EIRELI,Salvador,-12.9718,-38.5011,2927408,município,Base Municipios-Brasileiros
BRASPRESS IPN,51.245.902/0001-29,1446,2,SANCLERLANDIA,Costa Perfumaria e Cosmético LTDA,Sanclerlândia,-16.197,-50.3124,5219001,município,Base Municipios-Brasileiros
BRASPRESS IPN,50.891.960/0001-67,1819,2,SANCLERLANDIA,COSTA DROGARIA LTDA,Sanclerlândia,-16.197,-50.3124,5219001,município,Base Municipios-Brasileiros
BRASPRESS IPN,18.821.426/0001-71,52,2,SANT'ANA DO LIVRAMENTO,DROGARIA ANGYFARMA LTDA,Sant'Ana do Livramento,-30.8773,-55.5392,4317103,município,Base Municipios-Brasileiros
BRASPRESS IPN,26.810.984/0001-60,1343,2,SANTA ADELIA,ELIANA SOLER DE GODOY STEFANO,Santa Adélia,-21.2427,-48.8063,3545605,município,Base Municipios-Brasileiros
BRASPRESS IPN,36.447.388/0001-10,1522,2,SANTA BARBARA DO LESTE,DISTRIBUIDORA DE MEDICAMENTOS SANTA BARBARA LTDA,Santa Bárbara do Leste,-19.9753,-42.1457,3157252,município,Base Municipios-Brasileiros
BRASPRESS IPN,22.236.562/0001-71,612,2,SANTA BARBARA DO LESTE,DROGARIA SANTA BÁRBARA EIRELLI ME,Santa Bárbara do Leste,-19.9753,-42.1457,3157252,município,Base Municipios-Brasileiros
BRASPRESS IPN,11.253.522/0001-11,1692,2,SANTA LUZIA,MAXIMA POPULAR,Santa Luzia,-19.7548,-43.8497,3157807,mapa anterior,Base Municipios-Brasileiros (código IBGE e coordenadas municipais)
BRASPRESS IPN,24.587.366/0001-77,629,2,SANTA MARIA DE JETIBA,DROGARIA UHLIG E VEIGA LTDA,Santa Maria de Jetibá,-20.0253,-40.7439,3204559,município,Base Municipios-Brasileiros
BRASPRESS IPN,16.913.709/0001-18,218,2,SANTA MARIA DO SUACUI,DROGARIA E PERFUMARIA SANTA TEREZINHA LTDA ME,Santa Maria do Suaçuí,-18.1896,-42.4139,3158201,município,Base Municipios-Brasileiros
BRASPRESS IPN,00.667.035/0001-89,616,2,SANTA RITA DE MINAS,FARMÁCIA SANTA RITA DE MINAS LTDA,Santa Rita de Minas,-19.876,-42.1363,3159357,município,Base Municipios-Brasileiros
BRASPRESS IPN,11.174.696/0001-99,512,2,SANTA TERESA,DROGARIA BORTOLINI LTDA - EPP,Santa Teresa,-19.9363,-40.5979,3204609,município,Base Municipios-Brasileiros
BRASPRESS IPN,25.194.127/0001-10,9,2,SANTANA DE PIRAPAMA,ABERIONE MENDES PEREIRA E CIA LTDA,Santana de Pirapama,-18.9962,-44.0409,3158508,mapa anterior,Base Municipios-Brasileiros (código IBGE e coordenadas municipais)
BRASPRESS IPN,10.605.923/0003-92,1666,2,SANTANA DO RIACHO,DROGARIA RIBEIRO BURGARELLI LTDA,Santana do Riacho,-19.1662,-43.722,3159001,município,Base Municipios-Brasileiros
BRASPRESS IPN,10.605.923/0001-20,383,2,SANTANA DO RIACHO,DROGARIA RIBEIRO BURGARELLI LTDA ME,Santana do Riacho,-19.1662,-43.722,3159001,município,Base Municipios-Brasileiros
BRASPRESS IPN,08.585.270/0001-13,183,2,SANTO ANTONIO DE PADUA,DROGARIA CIDADE NOVA DE PADUA LTDA.,Santo Antônio de Pádua,-21.541,-42.1832,3304706,município,Base Municipios-Brasileiros
BRASPRESS IPN,07.258.077/0001-05,419,2,SANTO ANTONIO DO JACINTO,DROGARIA SENHOR DOS PASSOS LTDA ME,Santo Antônio do Jacinto,-16.5332,-40.1817,3160306,município,Base Municipios-Brasileiros
BRASPRESS IPN,13.153.971/0001-13,1784,2,SAO BENEDITO DO SUL,LIDIA MARIA BEZERRA DE PAULA E CIA LTDA,São Benedito do Sul,-8.8166,-35.9453,2612901,município,Base Municipios-Brasileiros
BRASPRESS IPN,42.608.210/0001-07,1939,2,SAO BERNARDO DO CAMPO,DROGARIA LECER 12,São Bernardo do Campo,-23.6914,-46.5646,3548708,município,Base Municipios-Brasileiros
BRASPRESS IPN,08.795.052/0001-03,401,2,SAO DOMINGOS DAS DORES,DROGARIA SOUZA E FERRAZ LTDA,São Domingos das Dores,-19.5246,-42.0106,3160959,município,Base Municipios-Brasileiros
BRASPRESS IPN,25.969.353/0001-25,1825,2,SAO DOMINGOS DO PRATA,EYDE JAMERSON MENDES,São Domingos do Prata,-19.8678,-42.971,3161007,município,Base Municipios-Brasileiros
BRASPRESS IPN,21.073.284/0001-16,26,2,SAO FELIX DE MINAS,DROGARIA BELLA D&A LTDA ME,São Félix de Minas,-18.5959,-41.4889,3161056,município,Base Municipios-Brasileiros
BRASPRESS IPN,08.948.560/0001-84,138,2,SAO FRANCISCO DE ITABAPOANA,H.S.PRODUTOS FARMACEUTICOS LTDA,São Francisco de Itabapoana,-21.4702,-41.1091,3304755,município,Base Municipios-Brasileiros
BRASPRESS IPN,62.786.380/0001-99,1866,2,SAO FRANCISCO DE ITABAPOANA,DROGARIA SAUDE CAMPOS LTDA,São Francisco de Itabapoana,-21.4702,-41.1091,3304755,município,Base Municipios-Brasileiros
BRASPRESS IPN,15.363.288/0001-36,622,2,SAO FRANCISCO DE ITABAPOANA,FARMACIA MARTINS SAUDE,São Francisco de Itabapoana,-21.4702,-41.1091,3304755,município,Base Municipios-Brasileiros
BRASPRESS IPN,33.832.224/0001-19,672,2,SAO FRANCISCO DE ITABAPOANA,INOVA FARMA LTDA,São Francisco de Itabapoana,-21.4702,-41.1091,3304755,município,Base Municipios-Brasileiros
BRASPRESS IPN,46.920.473/0001-08,717,2,SAO FRANCISCO DE ITABAPOANA,PS FARMA LTDA 1494,São Francisco de Itabapoana,-21.4702,-41.1091,3304755,município,Base Municipios-Brasileiros
BRASPRESS IPN,39.712.702/0001-33,671,2,SAO FRANCISCO DEITABAPOANA,MUSSOLINI E SOUZA FARMA LTDA,São Francisco de Itabapoana,-21.4702,-41.1091,3304755,grafia alternativa,Base Municipios-Brasileiros
BRASPRESS IPN,30.007.625/0001-46,737,2,SAO FRANCISCO DO GUAPORE,BK COMERCIO DE MEDICAMENTOS LTDA,São Francisco do Guaporé,-12.052,-63.568,1101492,município,Base Municipios-Brasileiros
BRASPRESS IPN,23.704.727/0001-55,516,2,SAO GABRIEL DA PALHA,AS CAZER MEDICAMENTOS LTDA,São Gabriel da Palha,-19.0182,-40.5365,3204708,município,Base Municipios-Brasileiros
BRASPRESS IPN,00.641.089/0001-75,339,2,SAO GONCALO,DROGARIA BIG DE SÃO GONÇALO LTDA.,São Gonçalo,-22.8268,-43.0634,3304904,município,Base Municipios-Brasileiros
BRASPRESS IPN,29.362.154/0001-05,340,2,SAO GONCALO,DROGARIA POLLO DE SANTA LUZIA LTDA.,São Gonçalo,-22.8268,-43.0634,3304904,município,Base Municipios-Brasileiros
BRASPRESS IPN,08.867.076/0001-20,593,2,SAO GONCALO,D ONOLATOS FARMACIA LTDA.,São Gonçalo,-22.8268,-43.0634,3304904,município,Base Municipios-Brasileiros
BRASPRESS IPN,12.915.415/0001-74,594,2,SAO GONCALO,FARMACIA POLLO DO SALGUEIRO LTDA,São Gonçalo,-22.8268,-43.0634,3304904,município,Base Municipios-Brasileiros
BRASPRESS IPN,11.295.013/0001-51,595,2,SAO GONCALO,DROGARIA POLLO DE ITAUNA LTDA.,São Gonçalo,-22.8268,-43.0634,3304904,município,Base Municipios-Brasileiros
BRASPRESS IPN,16.697.957/0001-79,596,2,SAO GONCALO,DROGARIA POLLO DE MARIA PAULA LTDA.,São Gonçalo,-22.8268,-43.0634,3304904,município,Base Municipios-Brasileiros
BRASPRESS IPN,71.281.588/0001-47,475,2,SAO GONCALO DO RIO ABAIXO,DROGAZITA LTDA ME,São Gonçalo do Rio Abaixo,-19.8221,-43.366,3161908,município,Base Municipios-Brasileiros
BRASPRESS IPN,52.057.899/0001-82,1386,2,SAO JOAO DO MANTENINHA,DROGARIA JOTAFARMA LTDA,São João do Manteninha,-18.723,-41.1628,3162575,município,Base Municipios-Brasileiros
BRASPRESS IPN,04.301.995/0001-81,243,2,SAO JOAO DO ORIENTE,DROGARIA E PERFUMARIA FERREIRA LTDA ME,São João do Oriente,-19.3384,-42.1575,3162609,município,Base Municipios-Brasileiros
BRASPRESS IPN,24.794.414/0001-06,561,2,SAO JOAO EVANGELISTA,FARMACIA GUERRA & GUERRA LTDA,São João Evangelista,-18.548,-42.7655,3162807,município,Base Municipios-Brasileiros
BRASPRESS IPN,12.141.197/0001-68,1645,2,SAO JOAQUIM DE BICAS,M & R MEDICAMENTOS E PERFUMARIA LTDA,São Joaquim de Bicas,-20.048,-44.2749,3162922,mapa anterior,Base Municipios-Brasileiros (código IBGE e coordenadas municipais)
BRASPRESS IPN,12.141.197/0002-49,202,2,SAO JOAQUIM DE BICAS,M&R MEDICAMENTOS E PERFUMARIA EIRELI,São Joaquim de Bicas,-20.048,-44.2749,3162922,mapa anterior,Base Municipios-Brasileiros (código IBGE e coordenadas municipais)
BRASPRESS IPN,14.363.166/0001-87,485,2,SAO JOSE,FARMA E SHOP DROGARIA LTDA,São José,-27.6136,-48.6366,4216602,município,Base Municipios-Brasileiros
BRASPRESS IPN,26.208.544/0001-37,344,2,SAO JOSE DA LAPA,DROGARIA POPULAR BH ME,São José da Lapa,-19.6971,-43.9586,3162955,mapa anterior,Base Municipios-Brasileiros (código IBGE e coordenadas municipais)
BRASPRESS IPN,03.965.112/0001-75,87,2,SAO JOSE DA LAPA,BARAO FARMA LTDA,São José da Lapa,-19.6971,-43.9586,3162955,mapa anterior,Base Municipios-Brasileiros (código IBGE e coordenadas municipais)
BRASPRESS IPN,08.976.754/0001-93,237,2,SAO JOSE DO CALCADO,DROGARIA FARMARI LTDA,São José do Calçado,-21.0274,-41.6636,3204807,município,Base Municipios-Brasileiros
BRASPRESS IPN,01.271.711/0003-25,1302,2,SAO JOSE DO GOIABAL,DROGARIAS RIBEIRO E RIBEIRO LTDA,São José do Goiabal,-19.9214,-42.7035,3163409,município,Base Municipios-Brasileiros
BRASPRESS IPN,06.165.458/0001-87,878,2,SAO JOSE DO JACURI,DROGARIA JACURÍ LTDA ME,São José do Jacuri,-18.281,-42.6729,3163508,município,Base Municipios-Brasileiros
BRASPRESS IPN,35.986.405/0001-25,1882,2,SAO MATEUS,DROGARIA SAO DOMINGOS LTDA,São Mateus,-18.7214,-39.8579,3204906,município,Base Municipios-Brasileiros
BRASPRESS IPN,03.456.251/0001-73,1883,2,SAO MATEUS,DROGAMARES LTDA,São Mateus,-18.7214,-39.8579,3204906,município,Base Municipios-Brasileiros
BRASPRESS IPN,75.279.221/0001-40,,2,SAO PAULO,JACIALDO MENESES DE ARAUJO SILVA (CNPJ FICTICIO),São Paulo,-23.5329,-46.6395,3550308,município,Base Municipios-Brasileiros
BRASPRESS IPN,40.047.636/0001-03,1493,2,SAO PAULO,FG FARMA LTDA,São Paulo,-23.5329,-46.6395,3550308,município,Base Municipios-Brasileiros
BRASPRESS IPN,39.741.054/0001-43,1521,2,SAO PAULO,DROGARIAS SALUS FARMA LTDA,São Paulo,-23.5329,-46.6395,3550308,município,Base Municipios-Brasileiros
BRASPRESS IPN,21.094.938/0001-98,1567,2,SAO PAULO,J S TEIXEIRA DROGARIA E PERFUMARIA LTDA,São Paulo,-23.5329,-46.6395,3550308,município,Base Municipios-Brasileiros
BRASPRESS IPN,21.281.020/0001-58,1621,2,SAO PAULO,TKN COMERCIO DE PRODUTOS FARMACEUTICOS LTDA,São Paulo,-23.5329,-46.6395,3550308,município,Base Municipios-Brasileiros
BRASPRESS IPN,30.071.045/0001-18,1622,2,SAO PAULO,NTK COMERCIO DE PRODUTOS FARMACEUTICOS LTD,São Paulo,-23.5329,-46.6395,3550308,município,Base Municipios-Brasileiros
BRASPRESS IPN,44.600.784/0001-64,1623,2,SAO PAULO,MANU COMERCIO DE PRODUTOS FARMACEUTICOS SLU LTDA,São Paulo,-23.5329,-46.6395,3550308,município,Base Municipios-Brasileiros
BRASPRESS IPN,26.400.383/0002-60,1624,2,SAO PAULO,HELOFARMA COMERCIO DE PRODUTOS FARMACEUTICOS LTDA,São Paulo,-23.5329,-46.6395,3550308,município,Base Municipios-Brasileiros
BRASPRESS IPN,26.400.383/0001-89,1625,2,SAO PAULO,HELOFARMA COMERCIO DE PRODUTOS FARMACEUTICOS LTDA,São Paulo,-23.5329,-46.6395,3550308,município,Base Municipios-Brasileiros
BRASPRESS IPN,48.876.412/0001-16,1634,2,SAO PAULO,DROGARIA DAYFARMA CARRAO LTDA,São Paulo,-23.5329,-46.6395,3550308,município,Base Municipios-Brasileiros
BRASPRESS IPN,46.235.084/0001-43,1698,2,SAO PAULO,BIFARMA,São Paulo,-23.5329,-46.6395,3550308,município,Base Municipios-Brasileiros
BRASPRESS IPN,40.591.131/0001-05,1705,2,SAO PAULO,DROGARIA BIFARMA,São Paulo,-23.5329,-46.6395,3550308,município,Base Municipios-Brasileiros
BRASPRESS IPN,04.011.868/0001-48,1706,2,SAO PAULO,NOVA LIDER,São Paulo,-23.5329,-46.6395,3550308,município,Base Municipios-Brasileiros
BRASPRESS IPN,21.557.436/0001-56,1707,2,SAO PAULO,DROGARIA ROBRU,São Paulo,-23.5329,-46.6395,3550308,município,Base Municipios-Brasileiros
BRASPRESS IPN,45.970.219/0001-51,1718,2,SAO PAULO,SWFARMA II COMERCIO DE PRODUTOS FARMACEUTICOS LTDA,São Paulo,-23.5329,-46.6395,3550308,município,Base Municipios-Brasileiros
BRASPRESS IPN,28.298.620/0004-10,1739,2,SAO PAULO,DROG RENOVAR,São Paulo,-23.5329,-46.6395,3550308,município,Base Municipios-Brasileiros
BRASPRESS IPN,53.250.281/0001-05,1744,2,SAO PAULO,PREÇO FARMA,São Paulo,-23.5329,-46.6395,3550308,município,Base Municipios-Brasileiros
BRASPRESS IPN,27.581.995/0001-88,1751,2,SAO PAULO,DROGARIA BESSA LANCA LTDA,São Paulo,-23.5329,-46.6395,3550308,município,Base Municipios-Brasileiros
BRASPRESS IPN,30.863.942/0001-64,1788,2,SAO PAULO,SANTANA FONSECA A&C FARMA LTDA,São Paulo,-23.5329,-46.6395,3550308,município,Base Municipios-Brasileiros
BRASPRESS IPN,30.863.942/0002-45,1789,2,SAO PAULO,SANTANA FONSECA A&C FARMA LTDA,São Paulo,-23.5329,-46.6395,3550308,município,Base Municipios-Brasileiros
BRASPRESS IPN,30.863.942/0003-26,1790,2,SAO PAULO,SANTANA FONSECA A&C FARMA LTDA,São Paulo,-23.5329,-46.6395,3550308,município,Base Municipios-Brasileiros
BRASPRESS IPN,56.189.160/0001-85,1799,2,SAO PAULO,DROGA STOP LTDA,São Paulo,-23.5329,-46.6395,3550308,município,Base Municipios-Brasileiros
BRASPRESS IPN,62.093.455/0012-09,1863,2,SAO PAULO,DROGA VIVER COM SAUDE LTDA,São Paulo,-23.5329,-46.6395,3550308,município,Base Municipios-Brasileiros
BRASPRESS IPN,61.693.880/0001-13,1864,2,SAO PAULO,DROGARIA SPM LTDA,São Paulo,-23.5329,-46.6395,3550308,município,Base Municipios-Brasileiros
BRASPRESS IPN,64.853.237/0001-06,1911,2,SAO PAULO,DROGARIA TINGUARA LTDA ME,São Paulo,-23.5329,-46.6395,3550308,município,Base Municipios-Brasileiros
BRASPRESS IPN,02.888.068/0001-84,1912,2,SAO PAULO,DROGARIA AUSTRIACA LTDA,São Paulo,-23.5329,-46.6395,3550308,município,Base Municipios-Brasileiros
BRASPRESS IPN,57.816.167/0001-42,1913,2,SAO PAULO,DROGARIA FERREIRA SANTOS LTDA,São Paulo,-23.5329,-46.6395,3550308,município,Base Municipios-Brasileiros
BRASPRESS IPN,59.555.894/0001-29,1923,2,SAO PAULO,DROGARIA MORAES E ZAMBONI LTDA,São Paulo,-23.5329,-46.6395,3550308,município,Base Municipios-Brasileiros
BRASPRESS IPN,26.694.569/0001-98,1927,2,SAO PAULO,MARCOS ROGERIO MARZOLA CELSO DROGARIA,São Paulo,-23.5329,-46.6395,3550308,município,Base Municipios-Brasileiros
BRASPRESS IPN,62.874.133/0001-44,1928,2,SAO PAULO,DROGARIA MARZOLA LTDA,São Paulo,-23.5329,-46.6395,3550308,município,Base Municipios-Brasileiros
BRASPRESS IPN,12.585.049/0001-32,1929,2,SAO PAULO,DROG LECER,São Paulo,-23.5329,-46.6395,3550308,município,Base Municipios-Brasileiros
BRASPRESS IPN,17.864.655/0001-00,1930,2,SAO PAULO,DROGARIA LECER 2 LTDA - ME,São Paulo,-23.5329,-46.6395,3550308,município,Base Municipios-Brasileiros
BRASPRESS IPN,20.626.664/0001-78,1931,2,SAO PAULO,DROGARIA LECER 3 LTDA,São Paulo,-23.5329,-46.6395,3550308,município,Base Municipios-Brasileiros
BRASPRESS IPN,29.155.206/0001-72,1932,2,SAO PAULO,DROGARIA LECER 4 LTDA,São Paulo,-23.5329,-46.6395,3550308,município,Base Municipios-Brasileiros
