transportadora,cnpj,codigo,rota,cidade,razao_social,nome_mapa,latitude,longitude,codigo_ibge,tipo_match,fonte_coordenada
BRASPRESS IPN,08.654.416/0001-35,474,2,AGUA BOA,DROGARIA JPM LTDA ME,Água Boa,-17.9914,-42.3806,3100609,município,Base Municipios-Brasileiros
BRASPRESS IPN,08.837.624/0001-70,53,2,AGUA BRANCA,JOSEFA MARIA DOS SANTOS GOMES,Água Branca,-9.262,-37.938,2700102,município,Base Municipios-Brasileiros
BRASPRESS IPN,20.008.109/0001-82,761,2,AGUAS FORMOSAS,SIMONE PEDROSO LEITE,Águas Formosas,-17.0802,-40.9384,3100906,município,Base Municipios-Brasileiros
BRASPRESS IPN,24.157.279/0001-80,35,2,AGUAS VERMELHAS,DROGARIA SOUZA RUAS LTDA,Águas Vermelhas,-15.7431,-41.4571,3101003,município,Base Municipios-Brasileiros
BRASPRESS IPN,17.683.534/0001-62,37,2,AGUAS VERMELHAS,DROGARIA SOUSA ROCHA LTDA,Águas Vermelhas,-15.7431,-41.4571,3101003,município,Base Municipios-Brasileiros
BRASPRESS IPN,07.657.931/0001-06,752,2,AGUIA BRANCA,F. C. RONCONI PADOVANI FORTUNA DROGARIA,Águia Branca,-18.9846,-40.7437,3200136,município,Base Municipios-Brasileiros
BRASPRESS IPN,36.010.141/0001-32,562,2,ALAGOINHAS,MALTA & MIRANDA COMERCIO DE MEDICAMENTOS LTDA,Alagoinhas,-12.1335,-38.4208,2900702,município,Base Municipios-Brasileiros
BRASPRESS IPN,10.411.824/0001-08,570,2,ALMADINA,FARMACIA LIZ LTDA,Almadina,-14.7089,-39.6415,2900900,município,Base Municipios-Brasileiros
BRASPRESS IPN,07.175.491/0001-50,320,2,ALMENARA,FIDELINO CARVALHO FILHO ME ALMENARA,Almenara,-16.1785,-40.6942,3101706,município,Base Municipios-Brasileiros
BRASPRESS IPN,18.826.208/0003-91,321,2,ALMENARA,DROGARIA PEREIRA CARVALHO LTDA,Almenara,-16.1785,-40.6942,3101706,município,Base Municipios-Brasileiros
BRASPRESS IPN,26.965.510/0001-97,711,2,ALMENARA,PHARMAVIDA PRODUTOS FARMACEUTICOS LTDA ME,Almenara,-16.1785,-40.6942,3101706,município,Base Municipios-Brasileiros
BRASPRESS IPN,10.730.142/0001-68,734,2,ALTO ALEGRE DOS PARECIS,F. J. DA SILVA EIRELI,Alto Alegre dos Parecis,-12.132,-61.835,1100379,município,Base Municipios-Brasileiros
BRASPRESS IPN,72.061.781/0001-35,478,2,ALTONIA,VEQUIATO COMERCIO PRODUTOS FARMACEUTICOS LTDA,Altônia,-23.8759,-53.8958,4100509,município,Base Municipios-Brasileiros
BRASPRESS IPN,41.921.198/0001-23,347,2,ALVARENGA,DROGARIA POUSAS LTDA ME,Alvarenga,-19.4174,-41.7317,3102209,município,Base Municipios-Brasileiros
BRASPRESS IPN,09.660.971/0001-32,107,2,ALVINOPOLIS,GUILHERME GOMES COELHO CARLOS ME,Alvinópolis,-20.1098,-43.0535,3102308,município,Base Municipios-Brasileiros
BRASPRESS IPN,06.114.176/0001-50,578,2,ALVORADA D'OESTE,FARMACIA MEDICAMENTO BARATO LTDA - ME,Alvorada D'Oeste,-11.3463,-62.2847,1100346,município,Base Municipios-Brasileiros
BRASPRESS IPN,09.666.786/0001-55,171,2,AMPARO DA SERRA,DROGARIA DRUGSTORE PIRES & BITENCOURT LTDA,Amparo do Serra,-20.5051,-42.8009,3102506,grafia alternativa,Base Municipios-Brasileiros (código IBGE e coordenadas municipais)
BRASPRESS IPN,03.700.189/0001-13,1433,2,ANAGE,DROGARIA CARDOSO & DIAS LTDA,Anagé,-14.6151,-41.1356,2901205,município,Base Municipios-Brasileiros
BRASPRESS IPN,22.044.204/0001-67,74,2,ANAJAS,1601 - A. R. GUIMARAES MEDICAMENTOS,Anajás,-0.996811,-49.9354,1500701,município,Base Municipios-Brasileiros
BRASPRESS IPN,40.126.576/0001-14,163,2,ANGELANDIA,DROGARIA ELEUTERIO EIRELI,Angelândia,-17.7279,-42.2641,3102852,município,Base Municipios-Brasileiros
BRASPRESS IPN,14.533.787/0001-61,1528,2,ANICUNS,J M B PHARMA LTDA,Anicuns,-16.4642,-49.9617,5201306,município,Base Municipios-Brasileiros
BRASPRESS IPN,10.750.495/0004-72,1910,2,APARECIDA,FARMACIA CLINICA LTDA,Aparecida,-22.8495,-45.2325,3502507,município,Base Municipios-Brasileiros
BRASPRESS IPN,18.765.588/0001-30,1629,2,APARECIDA DE GOIANIA,MIRANDA - COMERCIO DE PRODUTOS FARMACEUTICO LTDA,Aparecida de Goiânia,-16.8198,-49.2469,5201405,município,Base Municipios-Brasileiros
BRASPRESS IPN,56.822.905/0001-00,1873,2,APERIBE,VIRTUAL FARMA RJ LTDA,Aperibé,-21.6252,-42.1017,3300159,município,Base Municipios-Brasileiros
BRASPRESS IPN,39.311.667/0001-40,698,2,APIACA,DROGARIA APIACA LTDA,Apiacá,-21.1523,-41.5693,3200508,município,Base Municipios-Brasileiros
BRASPRESS IPN,24.186.432/0001-05,573,2,ARACAJU,FARMACIA MAISMED LTDA - ME,Aracaju,-10.9091,-37.0677,2800308,município,Base Municipios-Brasileiros
BRASPRESS IPN,32.810.988/0001-40,576,2,ARACAJU,FARMÁCIA MAX LTDA,Aracaju,-10.9091,-37.0677,2800308,município,Base Municipios-Brasileiros
BRASPRESS IPN,32.859.779/0001-91,610,2,ARACAJU,FARMACIA JR SOUZA LTDA - ME,Aracaju,-10.9091,-37.0677,2800308,município,Base Municipios-Brasileiros
BRASPRESS IPN,25.418.179/0001-22,441,2,ARACUAI,DROGARIA PEDRO & SÍLVIA LTDA ME,Araçuaí,-16.8523,-42.0637,3103405,município,Base Municipios-Brasileiros
BRASPRESS IPN,33.472.299/0001-36,657,2,ARAME,DROGARIA JUNIOR,Arame,-4.88347,-46.0032,2100956,município,Base Municipios-Brasileiros
BRASPRESS IPN,25.296.118/0001-30,29,2,ARICANDUVA,ELIANA SANTOS DROGARIA POPULAR LTDA,Aricanduva,-17.8666,-42.5533,3104452,município,Base Municipios-Brasileiros
BRASPRESS IPN,13.014.371/0001-74,656,2,ARICANDUVA,GERALDO LUCIO DROGARIA MAIS SAUDE LTDA,Aricanduva,-17.8666,-42.5533,3104452,município,Base Municipios-Brasileiros
BRASPRESS IPN,51.669.740/0001-56,1839,2,ARUJA,MARCIA LELES PEREIRA,Arujá,-23.3965,-46.32,3503901,município,Base Municipios-Brasileiros
BRASPRESS IPN,75.560.641/0001-08,,2,ASSIS,MATHEUS WENDELL CARDOSO RIBEIRO,Assis,-22.66,-50.4183,3504008,município,Base Municipios-Brasileiros
BRASPRESS IPN,00.115.960/0001-05,63,2,ASSIS,MEDICAMENTOS BRASIL DE ASSIS LTDA - EPP,Assis,-22.66,-50.4183,3504008,município,Base Municipios-Brasileiros
BRASPRESS IPN,64.427.109/0001-92,1905,2,AUGUSTINOPOLIS,ROBERTO SANTOS EVANGELISTA,Augustinópolis,-5.46863,-47.8863,1702554,município,Base Municipios-Brasileiros
BRASPRESS IPN,48.578.762/0001-04,1288,2,BAIXA GRANDE,FARMACIA AVENIDA DE BAIXA GRANDE LTDA.,Baixa Grande,-11.9519,-40.169,2902609,município,Base Municipios-Brasileiros
BRASPRESS IPN,27.502.286/0001-60,115,2,BALDIM,ANDRESSA MARIA NASCIMENTO - ME,Baldim,-19.2832,-43.9613,3105004,município,Base Municipios-Brasileiros
BRASPRESS IPN,11.091.780/0001-49,461,2,BARAO DE COCAIS,VILA COCAIS DROGARIA & PERFUMARIA LTDA,Barão de Cocais,-19.9389,-43.4755,3105400,município,Base Municipios-Brasileiros
BRASPRESS IPN,31.166.207/0001-64,1538,2,BARRA,EULA MAHELE DE CARVALHO SOARES COSTA,Barra,-11.0859,-43.1459,2902708,município,Base Municipios-Brasileiros
BRASPRESS IPN,12.110.047/0001-97,1373,2,BARRA DO CHOCA,NEIFARMA PRODUTOS FARMACEUTICOS LTDA,Barra do Choça,-14.8654,-40.5791,2902906,município,Base Municipios-Brasileiros
BRASPRESS IPN,08.798.328/0001-07,1562,2,BARRA MANSA,ANA PAULA DE AZEVEDO BALBI FARMÁCIA LTDA,Barra Mansa,-22.5481,-44.1752,3300407,município,Base Municipios-Brasileiros
BRASPRESS IPN,08.798.328/0002-98,1563,2,BARRA MANSA,ANA PAULA DE A BALBI FARMACIA ME,Barra Mansa,-22.5481,-44.1752,3300407,município,Base Municipios-Brasileiros
BRASPRESS IPN,08.798.328/0003-79,1564,2,BARRA MANSA,ANA PAULA BALBI DE AZEVEDO FARMÁCIA LTDA,Barra Mansa,-22.5481,-44.1752,3300407,município,Base Municipios-Brasileiros
BRASPRESS IPN,28.676.336/0001-98,613,2,BARRA MANSA,FARMÁCIA SANTA HELENA LTDA. ME,Barra Mansa,-22.5481,-44.1752,3300407,município,Base Municipios-Brasileiros
BRASPRESS IPN,15.154.373/0001-94,1434,2,BARRETOS,TAVARES MEDICAMENTOS LTDA,Barretos,-20.5531,-48.5698,3505500,município,Base Municipios-Brasileiros
BRASPRESS IPN,01.167.056/0001-06,407,2,BELA VISTA DE MINAS,RENATA FERREIRA GRIJÓ,Bela Vista de Minas,-19.8302,-43.0922,3106002,município,Base Municipios-Brasileiros
BRASPRESS IPN,42.566.560/0001-58,1845,2,BELFORD ROXO,FARMACIA E DROGARIA BEL FARMA LTDA,Belford Roxo,-22.764,-43.3992,3300456,município,Base Municipios-Brasileiros
BRASPRESS IPN,01.667.081/0001-40,185,2,BELFORD ROXO,DROGARIA ROSE COLLARES LTDA,Belford Roxo,-22.764,-43.3992,3300456,município,Base Municipios-Brasileiros
BRASPRESS IPN,32.944.450/0001-29,526,2,BELO CAMPO,FARMÁCIA DO POVO DO BRASIL LTDA,Belo Campo,-15.0334,-41.2652,2903508,município,Base Municipios-Brasileiros
BRASPRESS IPN,48.637.898/0001-30,,2,BELO HORIZONTE,DROGARIA FARMACÊUTICO,Belo Horizonte,-19.9102,-43.9266,3106200,mapa anterior,Base Municipios-Brasileiros (código IBGE e coordenadas municipais)
BRASPRESS IPN,07.741.201/0001-99,1505,2,BELO HORIZONTE,DROGARIA TLC LTDA,Belo Horizonte,-19.9102,-43.9266,3106200,mapa anterior,Base Municipios-Brasileiros (código IBGE e coordenadas municipais)
BRASPRESS IPN,17.312.562/0001-73,1513,2,BELO HORIZONTE,DROGARIA BARAO LTDA,Belo Horizonte,-19.9102,-43.9266,3106200,mapa anterior,Base Municipios-Brasileiros (código IBGE e coordenadas municipais)
BRASPRESS IPN,46.951.064/0001-79,1609,2,BELO HORIZONTE,DROGARIA POPULAR ALVES MEDS LTDA,Belo Horizonte,-19.9102,-43.9266,3106200,mapa anterior,Base Municipios-Brasileiros (código IBGE e coordenadas municipais)
BRASPRESS IPN,37.038.150/0001-02,1740,2,BELO HORIZONTE,FARMAXIMA DRUGSTORE LTDA.,Belo Horizonte,-19.9102,-43.9266,3106200,mapa anterior,Base Municipios-Brasileiros (código IBGE e coordenadas municipais)
BRASPRESS IPN,07.163.584/0001-65,1777,2,BELO HORIZONTE,DROGARIA VITAE,Belo Horizonte,-19.9102,-43.9266,3106200,mapa anterior,Base Municipios-Brasileiros (código IBGE e coordenadas municipais)
BRASPRESS IPN,48.270.297/0001-31,1884,2,BELO HORIZONTE,DROGARIA GAMA LTDA,Belo Horizonte,-19.9102,-43.9266,3106200,mapa anterior,Base Municipios-Brasileiros (código IBGE e coordenadas municipais)
BRASPRESS IPN,19.562.792/0001-16,217,2,BELO HORIZONTE,DROGARIA E PERFUMARIA PRATES LTDA,Belo Horizonte,-19.9102,-43.9266,3106200,mapa anterior,Base Municipios-Brasileiros (código IBGE e coordenadas municipais)
BRASPRESS IPN,24.019.150/0001-05,221,2,BELO HORIZONTE,DROGARIA DA PAZ LTDA,Belo Horizonte,-19.9102,-43.9266,3106200,mapa anterior,Base Municipios-Brasileiros (código IBGE e coordenadas municipais)
BRASPRESS IPN,47.732.421/0001-70,250,2,BELO HORIZONTE,RODRIGUES E MOREIRA LTDA,Belo Horizonte,-19.9102,-43.9266,3106200,mapa anterior,Base Municipios-Brasileiros (código IBGE e coordenadas municipais)
BRASPRESS IPN,31.131.047/0001-18,252,2,BELO HORIZONTE,DROGARIA GLOBAL LTDA,Belo Horizonte,-19.9102,-43.9266,3106200,mapa anterior,Base Municipios-Brasileiros (código IBGE e coordenadas municipais)
BRASPRESS IPN,16.676.389/0001-20,253,2,BELO HORIZONTE,DROGASERRA LTDA,Belo Horizonte,-19.9102,-43.9266,3106200,mapa anterior,Base Municipios-Brasileiros (código IBGE e coordenadas municipais)
BRASPRESS IPN,44.386.198/0001-69,345,2,BELO HORIZONTE,LUARA STELLA LEAL LTDA,Belo Horizonte,-19.9102,-43.9266,3106200,mapa anterior,Base Municipios-Brasileiros (código IBGE e coordenadas municipais)
BRASPRESS IPN,17.321.383/0001-00,346,2,BELO HORIZONTE,DROGARIA KIT LTDA - ME,Belo Horizonte,-19.9102,-43.9266,3106200,mapa anterior,Base Municipios-Brasileiros (código IBGE e coordenadas municipais)
BRASPRESS IPN,03.682.265/0001-05,350,2,BELO HORIZONTE,DROGARIA PROFETA LTDA,Belo Horizonte,-19.9102,-43.9266,3106200,mapa anterior,Base Municipios-Brasileiros (código IBGE e coordenadas municipais)
BRASPRESS IPN,03.858.078/0001-30,469,2,BELO HORIZONTE,DROGARIA WEBFARMA LTDA,Belo Horizonte,-19.9102,-43.9266,3106200,mapa anterior,Base Municipios-Brasileiros (código IBGE e coordenadas municipais)
BRASPRESS IPN,21.888.573/0001-73,580,2,BELO HORIZONTE,FARMACIA MINAS FARMA DRUGSTORE LTDA- ME,Belo Horizonte,-19.9102,-43.9266,3106200,mapa anterior,Base Municipios-Brasileiros (código IBGE e coordenadas municipais)
BRASPRESS IPN,41.965.651/0001-01,174,2,BELO ORIENTE,DROGARIA CARMO & BENFICA LTDA,Belo Oriente,-19.2199,-42.4828,3106309,município,Base Municipios-Brasileiros
BRASPRESS IPN,11.666.595/0001-35,296,2,BERILO,FABIO ELEUTÉRIO OLIVEIRA,Berilo,-16.9567,-42.4606,3106507,município,Base Municipios-Brasileiros
BRASPRESS IPN,41.933.573/0002-36,13,2,BETIM,COMERCIAL PENELOPI LTDA ME (FILIAL),Betim,-19.9668,-44.2008,3106705,mapa anterior,Base Municipios-Brasileiros (código IBGE e coordenadas municipais)
BRASPRESS IPN,41.933.573/0001-55,14,2,BETIM,COMERCIAL PENELOPI LTDA ME (MATRIZ),Betim,-19.9668,-44.2008,3106705,mapa anterior,Base Municipios-Brasileiros (código IBGE e coordenadas municipais)
BRASPRESS IPN,55.976.960/0001-83,1778,2,BLUMENAU,HILLS FARMA,Blumenau,-26.9155,-49.0709,4202404,município,Base Municipios-Brasileiros
BRASPRESS IPN,28.007.000/0001-32,1861,2,BOA VISTA,STUDIO AQUELE UP LTDA,Boa Vista,2.82384,-60.6753,1400100,município,Base Municipios-Brasileiros
BRASPRESS IPN,13.100.248/0001-76,133,2,BOM JESUS DA LAPA,DROGA MIL PRODUTOS FARMACEUTICOS LTDA,Bom Jesus da Lapa,-13.2506,-43.4108,2903904,município,Base Municipios-Brasileiros
BRASPRESS IPN,34.193.814/0001-01,288,2,BOM JESUS DA LAPA,DROGARIA MEGA FARMA LTDA,Bom Jesus da Lapa,-13.2506,-43.4108,2903904,município,Base Municipios-Brasileiros
BRASPRESS IPN,24.698.562/0001-19,493,2,BOM JESUS DO AMPARO,FARMA MH FONSECA LTDA-ME,Bom Jesus do Amparo,-19.7054,-43.4782,3107703,município,Base Municipios-Brasileiros
BRASPRESS IPN,27.794.078/0003-43,700,2,BOM JESUS DO GALHO,OLIVEIRA & SILVA FARMACEUTICA LTDA,Bom Jesus do Galho,-19.836,-42.3165,3107802,município,Base Municipios-Brasileiros
BRASPRESS IPN,27.794.078/0001-81,701,2,BOM JESUS DO GALHO,OLIVEIRA & SILVA FARMACÊUTICA LTDA-ME,Bom Jesus do Galho,-19.836,-42.3165,3107802,município,Base Municipios-Brasileiros
BRASPRESS IPN,55.531.950/0001-34,1665,2,BRASIL NOVO,DROGARIA CARNEIRO COM. DE MEDICAMENTOS LTDA,Brasil Novo,-3.29792,-52.534,1501725,município,Base Municipios-Brasileiros
BRASPRESS IPN,12.163.373/0001-62,124,2,BRASILIA,JC SIQUEIRA DROGARIA LTDA,Brasília,-15.7795,-47.9297,5300108,município,Base Municipios-Brasileiros
BRASPRESS IPN,10.188.343/0001-85,125,2,BRASILIA,DROGARIA ANA LIDIA LTDA,Brasília,-15.7795,-47.9297,5300108,município,Base Municipios-Brasileiros
BRASPRESS IPN,52.572.875/0001-61,1378,2,BRASILIA,SAO CARLOS DROGARIA LTDA,Brasília,-15.7795,-47.9297,5300108,município,Base Municipios-Brasileiros
BRASPRESS IPN,13.985.470/0001-01,1530,2,BRASILIA,SANTOS MARINHO COMERCIO DE MEDICAMENTOS LTDA,Brasília,-15.7795,-47.9297,5300108,município,Base Municipios-Brasileiros
BRASPRESS IPN,09.400.154/0001-45,1959,2,BRASILIA,DROGARIA MRS LTDA,Brasília,-15.7795,-47.9297,5300108,município,Base Municipios-Brasileiros
BRASPRESS IPN,43.625.543/0001-07,99,2,BRASILIA,CRISTINA FARMA DROGARIA LTDA.,Brasília,-15.7795,-47.9297,5300108,município,Base Municipios-Brasileiros
BRASPRESS IPN,57.182.349/0001-09,1752,2,BREVES,A W D FARMACIA LTDA,Breves,-1.68036,-50.4791,1501808,município,Base Municipios-Brasileiros
BRASPRESS IPN,48.838.604/0001-38,1342,2,CACHOEIRA ALTA,NILVANIA MELO DE OLIVEIRA LTDA,Cachoeira Alta,-18.7618,-50.9432,5204102,município,Base Municipios-Brasileiros
BRASPRESS IPN,53.428.600/0001-11,1526,2,CACHOEIRO DE ITAPEMIRIM,DROGARIA SANTA LUZIA LTDA,Cachoeiro de Itapemirim,-20.8462,-41.1198,3201209,município,Base Municipios-Brasileiros
BRASPRESS IPN,24.468.941/0001-12,367,2,CACHOEIRO DE ITAPEMIRIM,O. M. DROGARIA EIRELI - ME,Cachoeiro de Itapemirim,-20.8462,-41.1198,3201209,município,Base Municipios-Brasileiros
BRASPRESS IPN,20.055.971/0001-46,368,2,CACHOEIRO DE ITAPEMIRIM,DROGARIA SAGRADA FAMÍLIA LTDA,Cachoeiro de Itapemirim,-20.8462,-41.1198,3201209,município,Base Municipios-Brasileiros
BRASPRESS IPN,33.163.301/0001-95,625,2,CACHOEIRO DE ITAPEMIRIM,DROGARIA N. S. APARECIDA LTDA,Cachoeiro de Itapemirim,-20.8462,-41.1198,3201209,município,Base Municipios-Brasileiros
BRASPRESS IPN,02.285.025/0001-04,628,2,CACHOEIRO DE ITAPEMIRIM,DROGARIA SAO CIPRIANO LTDA,Cachoeiro de Itapemirim,-20.8462,-41.1198,3201209,município,Base Municipios-Brasileiros
BRASPRESS IPN,09.046.237/0001-88,1494,2,CAETANOS,ALT COMERCIO DE PRODUTOS FARMACEUTICOS E PERFUMARIA LTDA,Caetanos,-14.3347,-40.9175,2905156,município,Base Municipios-Brasileiros
BRASPRESS IPN,29.099.568/0001-93,1512,2,CAETE,LIDER SBX DROGARIAS LTDA,Caeté,-19.8826,-43.6704,3110004,mapa anterior,Base Municipios-Brasileiros (código IBGE e coordenadas municipais)
BRASPRESS IPN,52.523.158/0001-40,1587,2,CAFARNAUM,FARMACIA DO DOUTOR LTDA,Cafarnaum,-11.6914,-41.4688,2905305,município,Base Municipios-Brasileiros
BRASPRESS IPN,45.663.025/0001-03,1764,2,CAIEIRAS,J&L PRODUTOS FARMACEUTICOS LTDA,Caieiras,-23.3607,-46.7397,3509007,município,Base Municipios-Brasileiros
BRASPRESS IPN,46.235.084/0002-24,1701,2,CAJAMAR,BIFARMA,Cajamar,-23.355,-46.8781,3509205,município,Base Municipios-Brasileiros
BRASPRESS IPN,35.723.176/0001-56,175,2,CAJATI,DROGARIA CENTERFARMA DE CAJATI LTDA 1496,Cajati,-24.7324,-48.1223,3509254,município,Base Municipios-Brasileiros
BRASPRESS IPN,44.692.111/0001-81,563,2,CAMPO FORMOSO,DROGARIA A FORMULA LTDA,Campo Formoso,-10.5105,-40.32,2906006,município,Base Municipios-Brasileiros
BRASPRESS IPN,28.298.620/0007-63,,2,CAMPO LIMPO PAULISTA,ENZO FARMA LTDA,Campo Limpo Paulista,-23.2078,-46.7889,3509601,município,Base Municipios-Brasileiros
BRASPRESS IPN,28.298.620/0006-82,1857,2,CAMPO LIMPO PAULISTA,ENZO FARMA LTDA,Campo Limpo Paulista,-23.2078,-46.7889,3509601,município,Base Municipios-Brasileiros
BRASPRESS IPN,14.853.200/0001-00,49,2,CANANEIA,RAEL HS COMERCIO DE MEDICAMENTOS LTDA,Cananéia,-25.0144,-47.9341,3509908,município,Base Municipios-Brasileiros
BRASPRESS IPN,54.262.290/0001-70,50,2,CANANEIA,REGIFARMA HS COMERCIO DE MEDICAMENTOS LTDA,Cananéia,-25.0144,-47.9341,3509908,município,Base Municipios-Brasileiros
BRASPRESS IPN,57.023.093/0001-97,1726,2,CAPELINHA,DROGARIA CAPELINHA,Capelinha,-17.6888,-42.5147,3112307,município,Base Municipios-Brasileiros
BRASPRESS IPN,07.020.362/0001-93,173,2,CAPELINHA,DROGARIA CAPELINHA LTDA,Capelinha,-17.6888,-42.5147,3112307,município,Base Municipios-Brasileiros
BRASPRESS IPN,07.020.362/0002-74,1940,2,CAPELINHA,DROGARIA CAPELINHA LTDA,Capelinha,-17.6888,-42.5147,3112307,município,Base Municipios-Brasileiros
BRASPRESS IPN,25.735.143/0001-72,444,2,CAPELINHA,DROGARIA SOMA LTDA,Capelinha,-17.6888,-42.5147,3112307,município,Base Municipios-Brasileiros
BRASPRESS IPN,44.968.784/0001-11,655,2,CAPELINHA,GE FARMA LTDA,Capelinha,-17.6888,-42.5147,3112307,município,Base Municipios-Brasileiros
BRASPRESS IPN,19.281.905/0001-05,271,2,CAPITAO ANDRADE,DROGARIA MAGNUS LTDA ME,Capitão Andrade,-19.0748,-41.8614,3112653,município,Base Municipios-Brasileiros
BRASPRESS IPN,08.343.566/0001-28,295,2,CAPITAO ENEIAS,DROGARIA E PERFUMARIA CAPITÃO ENEIAS,Capitão Enéas,-16.3265,-43.7084,3112703,grafia alternativa,Base Municipios-Brasileiros
BRASPRESS IPN,12.118.973/0001-09,415,2,CAPITAO ENEIAS,DROGARIA E PERFUMARIA IRMÃOS NOGUEIRA LTDA,Capitão Enéas,-16.3265,-43.7084,3112703,grafia alternativa,Base Municipios-Brasileiros
BRASPRESS IPN,22.318.479/0001-41,282,2,CARAI,DROGARIA KRETLE E MATOS LTDA ME,Caraí,-17.1862,-41.7004,3113008,município,Base Municipios-Brasileiros
BRASPRESS IPN,51.809.436/0001-67,1618,2,CARAPICUIBA,DROGARIA NOVA GERACAO DANTE CARRARO LTDA,Carapicuíba,-23.5235,-46.8407,3510609,município,Base Municipios-Brasileiros
BRASPRESS IPN,47.951.701/0001-70,1619,2,CARAPICUIBA,DROGARIA NOVA GERACAO LTDA,Carapicuíba,-23.5235,-46.8407,3510609,município,Base Municipios-Brasileiros
BRASPRESS IPN,60.774.206/0001-09,1785,2,CARAPICUIBA,DROGARIA NOVA GERACAO,Carapicuíba,-23.5235,-46.8407,3510609,município,Base Municipios-Brasileiros
BRASPRESS IPN,65.120.013/0001-40,,2,CARATINGA,DROGARIA SANGLARD LTDA,Caratinga,-19.7868,-42.1292,3113404,município,Base Municipios-Brasileiros
BRASPRESS IPN,16.830.844/0003-61,742,2,CARATINGA,RPX DROGARIA E PERFUMARIA LTDA- EPP,Caratinga,-19.7868,-42.1292,3113404,município,Base Municipios-Brasileiros
BRASPRESS IPN,16.830.844/0001-08,750,2,CARATINGA,RPX DROGARIA E PERFUMARIA LTDA- EPP,Caratinga,-19.7868,-42.1292,3113404,município,Base Municipios-Brasileiros
BRASPRESS IPN,04.073.376/0001-87,17,2,CARBONITA,DIDI DROGARIA E PERFUMARIA EIRELI-ME,Carbonita,-17.5255,-43.0137,3113503,município,Base Municipios-Brasileiros
BRASPRESS IPN,31.812.100/0001-46,638,2,CARIACICA,FARMÁCIA VILAÇA EIRELI,Cariacica,-20.2632,-40.4165,3201308,município,Base Municipios-Brasileiros
BRASPRESS IPN,05.816.215/0001-07,410,2,CARLOS CHAGAS,DROGARIA DOFFEMOND COSTA LTDA EPP,Carlos Chagas,-17.6973,-40.7723,3113701,município,Base Municipios-Brasileiros
BRASPRESS IPN,28.782.610/0001-03,517,2,CARMO,FARMACIA CENTRAL DE CARMO LTDA,Carmo,-21.931,-42.6046,3301207,município,Base Municipios-Brasileiros
BRASPRESS IPN,52.456.059/0001-92,1361,2,CASTELO,M.M DROGARIA LTDA,Castelo,-20.6033,-41.2031,3201407,município,Base Municipios-Brasileiros
BRASPRESS IPN,59.157.457/0001-57,1741,2,CATENDE,FARMACIA SANTANA LTDA,Catende,-8.67509,-35.7024,2604205,município,Base Municipios-Brasileiros
BRASPRESS IPN,00.930.739/0001-00,1589,2,CATIGUA,DROGARIA SAO SEBASTIAO CATIGUA LTDA,Catiguá,-21.0519,-49.0616,3511201,município,Base Municipios-Brasileiros
BRASPRESS IPN,06.031.296/0001-94,1593,2,CATIGUA,BARATO & NETO - DROGARIA LTDA,Catiguá,-21.0519,-49.0616,3511201,município,Base Municipios-Brasileiros
BRASPRESS IPN,15.718.148/0001-33,352,2,CATUJI,MIRANFARMA LTDA,Catuji,-17.3018,-41.5276,3115458,município,Base Municipios-Brasileiros
BRASPRESS IPN,45.317.858/0001-12,682,2,CAXIAS,MARIA DE GORETI BRITO SILVA LTDA,Caxias,-4.86505,-43.3617,2103000,município,Base Municipios-Brasileiros
BRASPRESS IPN,53.808.550/0001-06,1497,2,CERQUEIRA CESAR,RM SESTITO PRODUTOS FARMACEUTICOS LTDA,Cerqueira César,-23.038,-49.1655,3511409,município,Base Municipios-Brasileiros
BRASPRESS IPN,16.886.475/0001-67,384,2,CHAPADA DO NORTE,DROGARIA SANTANA CHAPADENSE LTDA ME,Chapada do Norte,-17.0881,-42.5392,3116100,município,Base Municipios-Brasileiros
BRASPRESS IPN,12.997.554/0001-94,236,2,COLATINA,DROGARIA E PERFUMARIA VIVA BEM LTDA,Colatina,-19.5493,-40.6269,3201506,município,Base Municipios-Brasileiros
BRASPRESS IPN,19.250.515/0001-78,677,2,COLATINA,LORENCINI & FIORESI LTDA ME,Colatina,-19.5493,-40.6269,3201506,município,Base Municipios-Brasileiros
BRASPRESS IPN,23.004.333/0001-94,1423,2,COLINAS DO TOCANTINS,MENDES LIMA PRODUTOS FARMACEUTICOS LTDA,Colinas do Tocantins,-8.05764,-48.4757,1705508,município,Base Municipios-Brasileiros
BRASPRESS IPN,09.633.598/0001-20,1468,2,COLINAS DO TOCANTINS,C W Comercio de produtos Ltda,Colinas do Tocantins,-8.05764,-48.4757,1705508,município,Base Municipios-Brasileiros
BRASPRESS IPN,13.335.649/0001-05,1424,2,COLMEIA,OK COMERCIO DE MEDICAMENTOS LTDA,Colméia,-8.72463,-48.7638,1716703,município,Base Municipios-Brasileiros
BRASPRESS IPN,00.662.872/0001-15,255,2,COLUNA,HERMAN VILLAMARIM GUERRA ME,Coluna,-18.2311,-42.8352,3116803,município,Base Municipios-Brasileiros
BRASPRESS IPN,42.366.473/0001-57,172,2,CONCEICAO DO CASTELO,DROGARIA BRUNA LTDA,Conceição do Castelo,-20.3639,-41.2417,3201704,município,Base Municipios-Brasileiros
BRASPRESS IPN,07.746.935/0001-60,207,2,CONCEICAO DO MATO DENTRO,DROGARIA DOS MENINOS LTDA,Conceição do Mato Dentro,-19.0344,-43.4221,3117504,município,Base Municipios-Brasileiros
BRASPRESS IPN,08.395.845/0001-35,463,2,CONCEICAO DO MATO DENTRO,DROGARIA VITALLY LTDA-ME,Conceição do Mato Dentro,-19.0344,-43.4221,3117504,município,Base Municipios-Brasileiros
BRASPRESS IPN,10.623.579/0001-00,706,2,CONCEICAO DO MATO DENTRO,OUROFARMA CMD DROGARIA LTDA,Conceição do Mato Dentro,-19.0344,-43.4221,3117504,município,Base Municipios-Brasileiros
BRASPRESS IPN,13.754.977/0001-46,721,2,CONCEICAO DO MATO DENTRO,REAL FARMA DROGARIA LTDA ME,Conceição do Mato Dentro,-19.0344,-43.4221,3117504,município,Base Municipios-Brasileiros
BRASPRESS IPN,12.372.067/0001-36,1301,2,CONCHAS,FRANCISCO FONTANELLI NETO,Conchas,-23.0154,-48.0134,3512308,município,Base Municipios-Brasileiros
BRASPRESS IPN,07.738.229/0001-77,1475,2,CONDEUBA,FARMACIA CARDOSO E MARTINS LTDA,Condeúba,-14.9022,-41.9718,2908705,município,Base Municipios-Brasileiros
BRASPRESS IPN,23.340.249/0001-41,97,2,CONGONHAS DO NORTE,SOARES E CIRINO DROGARIA LTDA ME,Congonhas do Norte,-18.8021,-43.6767,3118106,município,Base Municipios-Brasileiros
BRASPRESS IPN,12.087.769/0001-78,225,2,CONSELHEIRO PENA,DROGARIA VIVEIROS E EVANGELISTA LTDA,Conselheiro Pena,-19.1789,-41.4736,3118403,município,Base Municipios-Brasileiros
BRASPRESS IPN,29.989.377/0001-05,139,2,CONTAGEM,DROGARIA MARTINS E OLIVEIRA LTDA ME,Contagem,-19.9321,-44.0539,3118601,mapa anterior,Base Municipios-Brasileiros (código IBGE e coordenadas municipais)
BRASPRESS IPN,23.397.532/0001-00,1875,2,CONTAGEM,DROGARIA VALERON LTDA,Contagem,-19.9321,-44.0539,3118601,mapa anterior,Base Municipios-Brasileiros (código IBGE e coordenadas municipais)
BRASPRESS IPN,49.210.923/0001-67,1908,2,CONTAGEM,BARBOSA E GUIMARAES DROGARIA LTDA,Contagem,-19.9321,-44.0539,3118601,mapa anterior,Base Municipios-Brasileiros (código IBGE e coordenadas municipais)
BRASPRESS IPN,20.947.368/0001-79,692,2,CONTAGEM,FARMÁCIA MINAS FARMA LTDA ME,Contagem,-19.9321,-44.0539,3118601,mapa anterior,Base Municipios-Brasileiros (código IBGE e coordenadas municipais)
BRASPRESS IPN,27.738.874/0001-05,716,2,CONTAGEM,DROGARIA E PERFUMARIA PRIMORDIAL LTDA,Contagem,-19.9321,-44.0539,3118601,mapa anterior,Base Municipios-Brasileiros (código IBGE e coordenadas municipais)
BRASPRESS IPN,48.947.387/0001-14,1827,2,CORDEIROS,FARMACIA DO POVO DE CORDEIROS LTDA,Cordeiros,-15.0356,-41.9308,2909000,município,Base Municipios-Brasileiros
BRASPRESS IPN,68.551.654/0001-47,326,2,CORONEL FABRICIANO,RONALDO MENEZES DE OLIVEIRA ME,Coronel Fabriciano,-19.5179,-42.6276,3119401,município,Base Municipios-Brasileiros
BRASPRESS IPN,20.885.087/0001-39,395,2,CORONEL FABRICIANO,OLIVEIRA & NOGUEIRA LTDA ME,Coronel Fabriciano,-19.5179,-42.6276,3119401,município,Base Municipios-Brasileiros
BRASPRESS IPN,09.238.755/0001-01,121,2,CORONEL MURTA,CHAMI E FERREIRA LTDA,Coronel Murta,-16.6148,-42.184,3119500,município,Base Municipios-Brasileiros
